Review ID,Review Content
ccf8ce00-a40f-43e6-a373-9b92845ba3e9,"Awful. No results , no reaction to art posts, I don't know any of these people, I think notifying members of others anniversary at a job is innapropriate and irrelevant. I have downloaded app several times thru the years with no results. It has not improved. That's my opinion."
546951fa-c786-40f9-9666-1b9ebbb9e220,No longer works - freezes on start up. Used to be a great app but now I'm unable to use. Uninstall and reinstall works for an hour or so and then back to it freezing on start up. I've had to resort to email (unbelievable) !
cc8c0459-5009-427e-a21a-8019cda69b53,"Keeps telling me LinkedIn in has stopped with the option: 🔶App info 🔶Close app 🔶Send feedback It's really frustrating. Has uninstalled and reinstalled severally yet no positive result, have upgraded on some occasions too but to no avail when I open through my browser, it won't allow me access all the features rather redirect me to open with app before I can enjoy it better. Please I need this fixed ASAP so I can access it fully through the app"
6ae7d5ec-debc-4bcd-88ed-a607404112ad,Failed design. When searching for jobs the location filter has some predefined cities you can choose from but you cannot set your own city. I have yet to see Seattle it other large tech area as one of the options so it's useless because your only get jobs from everywhere.
9e03b4cb-1527-4043-b8cf-523f021705d2,"I can't delete this useless app from my phone. Zero use to me but it came with the phone. I stopped the automatic updates but now my other apps won't update automatically and require approval. This app is a waste of my time and data. I'm sure it's good for those with or finding a career/job, but for me at this time of my life at least, it is useless."
8f95479e-1e3f-4670-8c19-29b24d8eb912,If you want to stay unemployed forever then this should be your choice. Not showing any jobs of my interest even after using filters and settings. There are only sales and marketing jobs. And that too most of the times in other states not nearby. And work from home jobs most of the time. Idk why this app is so much hyped.
b21cc524-e874-447c-ba17-65186a8bc941,Absolutely useless. Filters won't work. No matter how many times we select what we want it shows international jobs or jobs which requires experience even though you may select for freshers or entry level. Other websites are much better!
fac8d5ef-7109-4331-bdf6-bb91a0d1f7e8,"Keeps asking for me to update, when I click on it, it takes me to my browser instead of my playstore. The browser is written in Chinese and the file is corrupted. I think the app might be compromised. After installing the app the name on it is also written in Chinese.... Its frustrating. Please fix this asap."
cfe2919d-f2bb-4c27-b5e1-28d71cb58e9c,Good morning. The app crashed immediately upon opening. I've tried to uninstall and reinstall as well as restart my phone. It started happening on Saturday October 22. I am writing this review only in hopes that Support will see it and fix the issue. Otherwise I have nothing bad to say about the app and will revise my rating. I have a 2022 Moto G Stylus 5G phone. Thank you in advance for your help.
bf6054eb-3753-40bc-b9b6-4f3b7c4b9aa6,"continually says ""sorry it looks like we took a wrong turn"" and won't work on any functionality of the app. It is incredibly frustrating. I get push notifications but it doesn't work."
dd919fbb-c386-4502-a7a6-1fe9b5723ee8,"I love Linkedin (there is a ton of flaws) but my rating is 1 star because this app is the worst when it comes to internet connectivity. For example if i see a video and i click to open the comments, it either takes for ever, or takes forever and says failed... Meanwhile internet works fine on other apps and websites."
264b67f4-995d-4a0b-b36a-d2404a422aae,"Very Bad Experience I hav been maintaining my LinkedIn account and profile properly..I don't understand y they have imposed restriction on my account. suddenly it's showing restricted when I tried to login this morning . I had a lot of important info and contacts and I'm not able to access anything, though it's very urgent and important."
8e65f89a-9a44-4491-9837-c2f1490bdc7f,"Don't even know where to start from so I'll just ""thank you"" for now considering me a recruiter just because I had a class exercise of networking and looking for some people in particular. Now I have to pay premium if I still want to do it. Probably would've done it if the app was better. But it crashes every day, signs out, etc."
aa352c2b-b3c4-457a-a831-f40b64954af8,"Ads are annoying, completely random spam. And the reporting feature is useless. My feed would be much more interesting if LinkedIn educated their ad spending customers in targeting, or actually did something based on my reporting. Ad settings are are mess, no way to control level of personalization. At least not to any effect."
71a0eb02-5b4f-475e-b853-b6a84202ba8f,"Managing notifications in the app is unnecessarily complicated, making it so you have to navigate through 20 different menus to disable all notifications. Really bad design choice for something that should be one click."
97089bb4-7630-46a2-8a45-56309079d805,"Hot garbage. Constantly have to add the area you are searching for jobs and sometimes the area is not available, even when it has been available in a previous search. Navigating of the app blows harder than a two dollar hooker."
4ab336e8-465a-41c6-b9b3-72205c5a39c5,"Absolutely disappointed, the customer service is very difficult to reach, I had to rely on the reviews to finally get a hold of these guys. Even though I clearly mentioned in my reviews i want to cancel my Premium subscription since I'm not able to find close the subscription due to some error these guys deducted my premium once again. Please refund the money, it's Huge amount for me, and i have paid it twice. Please consider my request and do the needful. Hope you guys will help me out."
e9f70df2-efe4-4844-a588-ec584848ee08,"The app has been really buggy of late, I'm logged in but unable to see any notifications or messages as it says that the link is broken. A ""logout failed"" prompt popped up when I tried, which actually succeeded but now I'm unable to log back in again and even the link to reset the password is broken. Is the app down??"
981b60a3-a955-4522-945f-50af0dd92163,"Horrendous Just signing into this app using two-step verification was a nightmare of broken and buggy attempts where eventually, I was suglddenly signed in, though my attempt sent me to the help files and I received an email saying the attempt was blocked. Worst of all, this was with my Microsoft account."
3d06fbcf-b8bf-4d0a-84a4-406faa54c5e8,"I was on LinkedIn for almost 10 years, never found a job from any of their listings and ended up on multiple spam and scam lists. I stopped working IT almost 2 years ago and moved to a different city and I still get multiple spam emails daily in my inbox for non existent or government job listings that are publicly available."
63c2f653-7cc8-4390-9d81-391734c6941b,"DO NOT GIVE CONTACT PERMISSION!!! This app asked for contacts syncing from my mobile phone to give me friends suggestions based on my phonebook. But after syncing daily from many years, it did not even show one contact which is in my phonebook. So what for it is asking to sync phone contacts? It must be reported and action must be taken as it is a privacy breach!!!"
843edd44-8881-4876-a288-09dc83647368,Being unable to search for jobs in MY area makes the app worthless. Even the search by location option only gives you a list to pick from...that's it. Great if you are in those few areas but otherwise worthless.
8347b0db-ba4c-4395-8c6a-6208b026ac8f,"Not what I thought this app was going to be, not helpful in job search, scammers on app. After trying to unsubscribe from email list takes me to linked in with no subscription Info to unsubscribe. So I uninstalled app but still receiving emails. Very frustating."
d5772655-11c5-4689-99e1-ce79e2ffb68d,"The app version has totally malfunctioned and doesn't load like 15 times a day and the message is displayed ""It's not you, It's us"" for no single reason since years. This needs major development and modifications when it comes to stability, and what LinkedIn is providing it's services as an application."
d6adf5d0-55b0-46e2-88a6-7a760f8a5359,"LinkedIn is very annoying with ads even thought ads are managed in advertisements settings. And the app is very harmful to my eyes. I can't use the app on my phone. I use linkedin my PC with darkmode extension. The app doesn't have any night mode feature. Even thought file sharing applications have dark mode. And it looks similar to the facebook UI , LinkedIn is a copycat. The app is crashing on my phone. I hate to use this app on my phone."
0ae5c42e-e4f3-4156-9a3a-398ec89736c7,Doesn't work at all says it's installed but when I click on the link it says will install soon well that was weeks ago and still nothing. When I try to run linked in just though Firefox I keep getting a pop-up window telling me is use the mobile app that won't install. What a waste of time!
670bff20-d403-4fcb-a648-3d2c26a38a2d,What is wrong with the server? It will not let me save my business page description. I get an error with the server message every time. I exit out of the settings then it tells me I have unsaved edits?? I can't save it if something is wrong with the server!
10646dd1-f5b8-4706-9876-a331e717b377,"The LinkedIn app is persistently buggy, not loading notifications, messages, or other content with a perfectly stable connection to wifi. Additionally, the website does not take misinformation spread on their platform seriously with no option to appeal the decision, understand the rationale behind the decision made, or any sort of transparency."
6164b734-19ad-4f9d-9c86-f52447b52e77,"I had subscribed for a trial version of LinkedIn a month ago. I wanted to unsubscribe today but the request won't get through. And yesterday when I was trying too do it through my mobile app, there was no option for it available. Moreover, when I'm going through the refund policy for review of the payment and account, I cannot submit it via conform and submit as it won't work. I'm highly disappointed in the service of LinkedIn. It says it's there to support customers during the crisis, but no!"
69519137-f75a-4c80-9480-27a47d7652cc,"UPDATE: This morning I was informed i had 9 new messages! i had no messages. then i followed the link given in the reply to my first review and received this message ""Oops, page not found"" The app is busy but fine, but the one thing that does annoy me is the spurious notifications. this morning i apparently had 1 invitation and 5 messages. but on opening the app actually i didn't"
fe1a9a2e-36a0-4b14-80a9-cafa360dc39f,"They constantly ask you to invite everyone you know to use linkedin then when you finally do to get rid of them asking their system will crash, you wont be able to send out connections and you will be forced to manually go in and withdraw all of the requests. Their support system will simply say 'well you should not have invited that many people' - even though this is a feature they have built into their system. Probably one of the worst experiences ive had with a customer support team."
046df6a2-a9dd-47d2-86c0-a6b62801be25,"UPDATE 1/3/23: Well the 3rd unsub request didn't work either. These people are totally inept at customer service. I had to go into app settings and manually go though every setting & turn everything OFF. Hopefully that will work. Now it feels like harassment. Thanks LinkedIn for ZERO support! UNSUBSCRIBING SEEMS IMPOSSIBLE!!! Tried to unsub 2x from their multiple emails a day, but still got them daily and even uninstalled the app. That didn't help. I tried to unsub for the 3rd time 1/2/23."
78c73d14-24c6-45ee-9c58-e88b30ab1e65,Why does the feed automatically refresh after clicking the 'back' button when inside a post? All the time I lose the feed I was watching and no way to find those posts again. Stop refreshing the feed automatically. This is super annoying. Also can't download images from posts anymore.
8458fb26-9c76-4548-810f-89af6de0fcd3,"Please bring an option to attach multiple photos, document. It's really annoying to attach the media or documents one by one. Please add the feature to add multiple files from SD card and phone memory easily."
50a88c25-ffd1-43a4-a4e8-a8e401bf91ac,"Latest version crashes on open = fail. Uninstalled and reinstalled, crashes on attempting to view messages. After that, since it try to open on messages from them on it crashes on every open. As a premium user paying $59/mo, this is unacceptable."
872320c0-2f11-44e4-b1bb-caeaaa49a974,"This app was working perfectly until about a week ago. anytime I click into any of the options at the bottom of the app it says ""No results found. something broke. Seems like we tool the wrong exit here"". essentially I cannot use the app as this is all the comes up when I try click on any of the options alerts, followers home etc."
3b8d9474-9573-4aa0-919e-0082732267ef,"When posting status updates for my organization i got an error with the message ""sorry, we could not post right now."" Later, I find that my organization's status update has been posted 5 times. Yes it worked, but I wish I didnt get an error message saying otherwise. Also, this app has no way for me to delete updates on my organization's page even though Im an admin. How do you not include such a basic feature ?"
279490b2-41e2-4bc8-8232-734ea5606991,This app offers nothing that the mobile version of the website doesn't. It consumes too much memory. Then the mobile version of the website is blasted with ads to use the app. Very clear that they just want to mine the data of your device.
d913576c-9e7c-43b0-a4bb-60be4c68010a,"I just joined and my account has been immediately restricted and I have done absolutely nothing with it yet. Literally nothing. No profile setup, no searches, no nothing. Now I'm being asked to upload images of personal info be it my drivers license, passport or ID. Something strange going on but I'm not even going to bother with support. I'll find another platform. Why do you need such sensitive personal information? F-off"
d889d299-c87e-4896-8631-2c5f2d005f51,No I don't want to download your app and I don't want to be reminded of its existence either when I access your mobile page once in a blue moon. Admittedly the mobile site is shockingly bad but your app follows closely behind. I think you already know that.
61600a2c-f6e4-4711-8e2b-0ba6e11a4f80,"Can't even update it after 2023.... now i'm trying to reinstall the app and it won't let me download the app. You've reached me via email and still no concrete solution as you pass the trouble to google play. I don't have any trouble with the other apps, it's just this one that has problems. Please fix it. I'm using android 13"
fe09a6be-6948-434a-a985-b9eeaee4dd2f,"Hi there I have a problem with linkedin app I try to uninstall app it accessible but to reinstall and get new features it doesn't work and leave a message that waiting for download and it won't finish to download, and I have bundle but it won't work and it cause other apps to stop or to get access to be installed I need a help please"
6f1caaaa-b659-4d93-a72d-a33d50f4bbee,"premium is definitely not worth it. there's nothing in it that you can use effectively. update on day number two. can I access nothing related to my premium even after uninstalling and reinstalling the app. If this is what $59 a month gets you oh, no thanks. the only reason it gets one-star is because you can't give it to 0 Stars"
3daa7422-dab8-4660-a53c-79e5f8120b46,"It came preinstalled with the phone I bought, and it does not allow to be uninstalled. It may be a great app, I do not know and do not care, since I didn't ask for it. Maybe the great minds that thought, forcing an app (and blocking its uninstalation) with a new phone will trick people into using it, maybe they will think again."
d6b3fc17-1b81-4740-85c3-8caef1fee123,Just switched phones and for some reason I'm unable to install the app on my new phone. The installation gets stuck at 91% and then fails after a few minutes. Been a week since I'm trying to install the LinkedIn app.
4a59d4a9-4fa5-4346-8bcd-e9f9defd2de6,Not able to post Open to work when I am editing my profile for post open to work then after click on save button app navigating me on my profile page it not showing a popup to post open to work like it was showing earlier . please fixed it or if having another way to post Open to work then please let me know. Thanks
30eeb7b8-2db7-419a-a377-42bddc8e1bf8,"OnePlus 5 Android version 9.0; I can't look up jobs. Fresh install, cache has been cleared, phone has been restarted and all i get is ""No results found. Something broke. Seems like we've taken the wrong exit here."" when I click on the job icon."
344fbd3a-2342-40c5-9b55-cff89aaf319a,"The app is always saying something went wrong. I have to refresh like 4 times before a page will load. I can't view notifications because it always say ""something went wrong"". Its a terrible experience"
b9bc224b-ad93-418c-8860-7263bb2edc2d,"The app doesn't work, always has errors. I've installed all updates and reinstalled the software a few times and the same problem occurs. Just a total waste of time and memory on my phone."
32c71ed4-b7fd-49f4-aba0-d04b45661bd6,Linkedin is eventually playing up and showing on and off my connection numbers. Recently I as a connection and it shows me as connection one min and removed connection next min. If refresh page then again same story. Such a disaster! I can't figure out if my recent connection is on or removed!!
9af7b9d0-992d-46c0-ba1c-eb38fb04a361,Used to be good but my GIFs aren't getting posted. The posting mechanism is the worst. Doesn't have any features. Once it held a great place but now it's just a bunch of grad students who have spammed it with their free Online Certificates with no real knowledge or good project.
2a91019f-eb0d-4476-be50-df7293a2185d,From day one i am using linked in its uselful to me 0%. So i tried premium its also same . the canceling process is too complecated after canceling my premium accout money got deducted there no fast customer support. Refund me my amount. before i delete my account. Its too bad experience. I have file case agains linked in. How smartly they have manage to purchse premium too easy and too dificult to cancele. Its froude they are doing
d83a50cd-e6da-4ab9-ad43-a6a825a3a6f5,Rapidly turning into a Facebook/Twitter-style junkyard . I suppose it supports metrics like engagement figures and 'impressions' (🙄) but I find the unmanageable newsfeed a giant turnoff. Unfortunately there is a small amount of useful and relevant info on LinkedIn so I can't abandon it completely.
d9204449-df82-48df-9097-2b25123caf73,This app was bundled with my Samsung phone without my knowledge.. Somehow it suddenly had access to my account without my (explicit) permission and started to make noise and show notifications in the middle of the night. I do not want any app to access my data without my explicit permission and i do not want any app to make noise in the middle of the night unless i have given explicit permission to do so.
c78232d1-b9ea-40b6-af1f-ca0efd47a3ff,Can't log in or find in my apps list. I have to search in appstore to open it. Then it doesnt take any of my login info. Says try again. Very frustrating. I need to update my email address because no longer working there.
f747a2bf-6d03-4c61-ab96-d0cdd85ef951,"My account has been restricted without any reason, and it says that it will remain restricted as long as I don't verify my account by submitting photos of my legal documents. Because I have a right to privacy and don't feel comfortable sharing my documents with this glitchy, unreliable platform, I am now permanently locked out of my account. I guess I will instead have to look for a good alternative to this useless platform."
6ee6eab9-92fc-466b-8147-ccb4bfdc8f15,Can't login at all. Human verification keep showing no matter what. Both puzzle and audio verification keep saying my responses are missing and invalid. Even if when the captcha says verification complete. Edit: don't tell me to clear cache and cookies. I did all of it and still can't login.
4b710bcd-881c-45f3-99f7-f78bb714d60e,"This is absolutely terrible from LinkedIn. Even with an updated version and a good network connection, nothing loads.I mean NOTHING. All that it shows is an error message. I honestly dont know why but please do look into it ."
1d109bea-e7a0-4f6f-b80a-d03c55f97ffa,"I normally live this app... However, over the past 2 days I am unable to post from my phone. When I click next it gives me option of who can see post and doesn't allow the post to be created. Like it's stuck in that option. Very frustrating!! I have a Samsung S10e Galaxy"
a28a4b0b-ac72-41cb-9797-2ae8680e4712,trying to update my profile should be an option easily found but it's not. you have people on LinkedIn who left those positions 8 and 9 years ago. if you're wondering why linkedin is doing poorly just look at how difficult it to do something as simple as updating your profile..
163af6fd-559d-43f9-bdb0-dfdb823ffae9,"I don't know what's the issue with you guys. my account was working fine for some days but noe suddenly when I opened my account after some time, while logging in it was giving the message "" Your account has been restricted reach online help"". After that I tried what you guys have said. but still I am not able to successfully login in my account. This kind of error and services is not expected from you guys.Now I have uninstalled the app. I hope you will look into this matter and resolve Problem"
e83ba872-67b0-4887-b196-4bcfeb394d60,"I used to like the app to search for jobs, but it doesn't work well anymore. Before I could search just by location without any title and it was giving me results according to my profile or previous researches I guess. Now I always have to write the title of the job or the company but still strange jobs come out."
820d02df-85a3-442a-95c9-8c0e39939f12,"1-screen viewing so pale and weak old eyes find it difficult to read and tiring. 2- the ad is an in my face ad which constantly interupted what I am doing which results in m getting pissed off with LinkedIn and going to an alternative site. Way to go guys, great marketing."
a45a1673-5ca4-48fc-8e48-c7c7ae5087ca,The app doesn't practice the privacy policy. I have kept my LinkedIn pictures as visible to connections and has set all the settings to private yet the moment I type my name on google. I can see my LinkedIn profile picture readily for any one to access.. And that's terrible
b73430f7-630a-4c75-ba42-330898e9d220,"The overall App is good but when it comes to login it is very annoying because we are unable to fill the captcha. After every captcha verificatyit is showing a message ""Your noCAPTCHA user response code is missing or invalid."" It is very disturbing bug🐞 in the login section. Try to make this bug clear as soon as possible."
9fd16a01-3a93-4c4e-8675-705a959c0c33,"No to stories. This is not appropriate for what's supposed to be a professional app. Not only will it be terrible for the mental health of those struggling in the workplace, it is just completely off putting. I do not want another FB or Insta clone, both of which I use much less because of all the noise"
986f8629-9f78-478a-8b23-5cb65baf5376,"I take back my 5 star review, this thing keeps bombarding me with notifications when I don't want it and with no real obvious way to turn it off inside the app. They don't explicitly show ""notification settings"" anywhere. Overall, not happy and uninstalled the app."
f3447ff7-dbc1-4e19-a48f-f49cbfd606b5,Linkedin sent an email saying I would be automatically added to a group unless I opted out. You can only opt out through the app apparently. This is all convoluted and a terrible experience.
a385b1c5-6c63-4725-8250-3706a8aca4f1,"If Google allowed for negative stars this would be the king of all apps. I ask that Google not allow this horrible, poor excuse of an app to be allowed. It continuously crashes, logs out in the middle of searches, and then just goves an unknown error has occurred. Only solution is to reinstall...joke Same BS...today is May 27th, and this garbage app quits without any reason. Then needs to reinstall, and still same BS. Would be nice to post a screenshot to show everyone not to use their time."
d79f5d47-f6d6-469d-a073-81c7a34552d0,This is a pathetic app.. Uploaded resume so many times but it is not showing. And I can not apply to any job because it keep saying ur email I'd is already used.. I don't know why they don't verify me properly at once and clear the process Definitely they are making it worse for me. Time wasted.They make it more complex for user. Worst service 👎
7040b0d5-027d-4d79-98d1-0ee6356b79ea,"when you click on links - the pages open in an embedded browser inside the app. Many links, including hugely popular publishing platform - Medium, fail to open and instead you're presented with web page unavailable. Terrible customer experience for £25 a month."
673034d8-9da4-48a1-97dc-03827fce1dbf,"I usually never write reviews, but this app is frustrating enough in it's UI, but the fact that I can't get past the authentication screen whether it would be the phone number or the captcha test. Horrible experience, would not download again."
b773e38f-bcc9-46eb-a335-e08821bad6d1,"No dark mode ffs it's 2021. EDIT: this feature has been in ""gradual"" roll out for years. My region is USA. Microsoft has added dark mode to an entire OS in the same time that this has feature has been in gradual roll out. Idk if gradual is the right word at this point."
