Review ID,Review Content
77f8fe19-e52e-492c-aee6-56f3c5957d76,I don't have a last name in any of my official documents but LinkedIn doesn't allow to make an account without a last name. Because of that i had to put my family name in my LinkedIn profile which makes the info on my account look fabricated and can hinder my opportunities in the future . So Please work on this issue and make the last name section of LinkedIn non required.
9ab00599-d64c-4af1-baa5-ebdd4d03dbb5,"Why do Microsoft continue to make it so difficult to manage your inbox and delete messaages in bulk? You have to go into each message before you can delete it, even if you have already read it or know that it is spam. What an awful UX. Its such a basic functionality, extremely frustrating and another reason for customers to try and distance themselves from all things Microsoft - such an awful bramd these days. Microsoft cant even get the basics right."
1a7a8795-4bd7-4092-9376-61bc53698f57,"Does not work. A lot of filters and fields do not work in the app, both in job search and easy apply. I have updated it multiple times now, hoping they would fix it, but its still not working. Also, there is no easy way to send feedback about the app malfunctioning. Would have expected more from linkedin."
ee298d89-a04a-4efe-ad3a-711c7ac7f607,"Didn't find it at all useful. Had a lot of fake notifications saying someone wants to join this and someone requested that, but as soon as you lose the app, there is nothing there. I dont think it is the app though as I get the same in emails, so it seems there is a huge flaw somewhere."
ad516a1a-c488-469b-9406-bcfcd465f1cc,"Useless ,only promtions and ads."
fae9e2fb-48c2-4eb3-b678-6c5970cc8377,"Not able to login. After security check. Getting error like ""your noCAPTCHA user response code is missing or invalid."
176c1c30-4c65-44ae-b888-c6c2d254383b,"It used to be good app, but for last 5-6 months not able to open it on my phone any more, always not responding."
6cde7019-5abb-4675-bc3f-fa5061ad84ef,Linked in! Sort your app out!!! 5his is the 4th time I've had to reinstall it. Get yourself sorted out!!!! Update!! - This has now happened a 7th time. Worst app I've ever had in terms of reliability. I have Samsung Galaxy and I have the latest version of the app. I've re-downloaded it 6 times so don't tell me to do that again. Sort your app out!!!!!!!!!
9c4648c0-1a5d-4c16-893b-f209362c23e1,Lost my original email address and LinkedIn has no way to update it to a current email.
e7bf4f40-03c5-477a-8b82-14304c94544e,"App has lots of bugs. 1) No matter what, I can't upload a post from my Phone, app says uploading but it doesn't and I end up using PC to upload a post. 2) I've turned on Creator Mode, but no matter how many times I try I can't add topics to Profile Topics. App keeps telling me : Unable to save topics, please try again later. 3) All Notifications are delayed. 4) Profile View count resets to 41 after the count exceeds 50 5) Endorsements number stuck to 1 and doesn't update."
f03103e6-b0a3-4061-8cd1-4d7e5b4a91c5,"Why does this app still prevent you from sharing more than 1 type of media? This restriction is so irritating. I collate images, videos and website addresses for a specific post and then find I have to choose between them. Not only is it outdated but it defeats the purpose of an app designed for sharing media!"
09f85e1e-c699-499e-ac5f-8638c890f384,Having the app installed on your phone serves as a detriment. Have been waiting years for deep links to work from the web but you just end up at the home screen and the post you clicked on is lost. Can't view comments on anything. Had to uninstall to view comments on web again. Please fix deep links
5f8a7ec5-e66e-4b13-8bf3-40d4d9a5ab0c,"I had to delete my account 3 times on LinkedIn because I was unable to update my profile picture and background picture whenever i tried to update it said, 'submission failed try again' but nothing happened. The same was happening with headline part. I tried to contact with linkeldn customer care but they just show some articles which aren't helpful at all rather then letting contact them and get the problem solved."
344a6265-5453-4b33-9154-839bc6f5ed7a,"Still Bad UX in managing Notifications, I mean in Notifications tab: - I can't mark all notifications as read, or show just unread notifications, or just show all notifications in a specific date. I hope you work on this 😑 Edit: - Also the link inserted in the post is not clickable, it is as a plain text. - Last update, You removed the save picture option. So sad, bad experience."
492e25f5-15b5-488a-921a-3f4a1a41b9af,The new version of linkedin has a major bug in it. I am surprised to see the update released with a proper testing by linkedin engineers. I am facing the problem with this new updated version of linkedin where job search when i choose location as worldwide it goes and picks my default location as US. Worldwide location is not being picked by its search feature of linkedin. Very unhappy with this new version of linkedin
d92c6ee4-d213-4ed3-a278-292031a3efac,"I used this for a long time and it worked great for finding a job for me for a long time. But the recent update changed their format f om a job search to social networking and they completely erased my account. I couldn't recover anything, and I have my resumé and certifications on this site to help me find specific work, now it's all gone and I'll have to start over. When I tried to recover my old profile it told me it never existed, or they couldn't find it. And I've been using it for YEARS!!"
40e08473-aa02-45d1-8275-e053a4220aaf,Stuck on puzzle verification loop. The react button doesn't work and so many other bugs!
1f9ad5e3-5374-4d42-b5d5-9e6c5007a9d2,"The application on my phone hasn't worked in weeks. I get a lot of notifications but when I go to the app an error occurs. Nothing is accessible, every page said sorrty try again. I thought maybe it would only be broken for a day or two but its been weeks or maybe even a month."
45842396-9792-4f66-abfe-4d71565a09e1,To be honest when LinkedIn first started it might have been a place where you could have meaningful connections. Nowadays it's mostly third party recruiters messaging you for positions for which you're most likely not qualified. The only thing I found useful were the job postings there. I have sent close to 40+ in mail messages over the span of three months when I was looking for a job with zero meaningful replies. Just my two cents
97841e68-1355-421a-be48-b4eafb0ce445,"Unwanted bloatware, can't be installed. Edit: Although the developer has added instructions to disable, they do not under stand that *I don't want it on my phone at all*.  It needlessly takes up storage, updates take up resources to download and store. Now if they gave me instructions to completely get rid of it, I'd remove this review."
f45af96a-0643-49de-920d-53bce4921e6f,"I was in hibernation for 2 years. Left hibernation to trial Premium. A couple hours later realized I didn't want it so I cancelled the trial through Google Play. Went back to hibernate my account, it said I couldn't unless my account was converted back to Basic. I have tried for two days on different devices. Nothing. Wrote a review here & was told to contact support. Support ran me in a circle only to FINALLY repeat what I already knew. ARCHAIC, UNHELPFUL."
88c85b98-bd67-4d17-83fa-6a2cbb8ec379,"LinkedIn Bugs. I love LI but since one month I'm experiencing a huge issue with posting on the Pages I manage from my mobile app. I've unistalled, update, reinstalled, uninstalled, sent a message to the customer service which answer is just uninstall it and check if it works. I wrote two times NO it doesn't, yes I already did all this. And there nooooo other solution. It makes me loose so much time for my work as I'm a digital marketer."
bab6d989-5013-49fd-8cdd-f5a4c2463c10,"Update made the app even more useless. Now you can no longer edit the working experience/background on your profile, it just shows a blank. Keeps opening links within the app. The option to open with browser is no longer available. Updates? More like downgrades. I'd resign if I were the person that keeps on approving those hideous updates."
ad0d4534-95b1-4430-ba98-58a40fd39d94,"So Bad ,, it only show 3 posts and stop after that and refresh it again even i have a strong internet"
3e2b636e-38cf-4d9c-a838-e24be9778a6b,"Awful, can't wait for the bombs to drop so that record of this attrocity will be vaporized"
ebf00add-c238-40b9-bfb5-434ab45c8491,"Ive dwnld app 3x now. whenever i click on different stuff to see (msgs, job search, ect), it mentions , ""oops, look like we took a wrong turn"" msg. 4/18 still unable to get into the app. after re-downloading several times i am just going to remove it. it says "" its not you, its us. or oops, something went wrong or retry."" i am done."
b916d4e6-da18-4820-9d4c-625d498c7ba8,"Can't login without any errors. UPD Since several months, it's still the same. Can't send verification email."
0677f5a8-81c9-49a1-a4ce-3ac766e3f32f,"LinkedIn is a great app. But in just a span of 2 months of using it, My profile has been restricted twice. I just wake up to find that I can't get into my account. I'm asked to verify my identity. I did. But it's taking forever for them to get me access back to my account. It's frustrating."
1bdfe1b6-fc3c-4762-9351-2219fdc9608c,"Issues have been fixed with Sept 30 release . Back to 5 stars. Update 24/11. This feedback is not for the app, but for LinkedIn service. The new ""Open to job opportunities"" section is terrible. I can't select more than 5 job types or locations. I am not able to leave any note to recruiters to describe my job seeking motivations. My profile views have dropped significantly after this change. if Linkedin is ""strong-arming"" members to get Premium, its not working."
b40365bf-37f6-4e0d-82c8-483b766fd651,"Very useful but yet buggy and app with worst user experience. Reasons 👇 Feel: It doesn't feel like a native app. it's more of webview-ish thing even though it's not. Network: Getting network error on every second comment and every fifth. reaction. Features: It doesn't even have basic UX features like most social media apps. Problems: it's slow and buggy, i am not even getting option to upload video from mobile app. P.S: don't ask me to uninstall and reinstall , it doesn't solve any problem."
0c1a9eb5-cddc-4cee-85ec-39b0685eff20,I cannot log in into my account!!! and i need that urgent! This captcha keeps giving error messages!! I need my account asap! Worst app ever!
ef84c824-1eae-40e5-8f1a-3f4f771d98fb,"This app is garbage. Tells me I have notifications, when I check there are none. Tells me I'm logged off, which I am not. Sends me the same notification for the same job as yesterday. I got the notification and went and looked at it. I don't need another one the next day or two days later. I uninstalled and then installed again. It worked properly for one day then same thing happened. Guess I'll just shut off my notifications from this app."
bb067593-4446-42c0-b90d-0297d28a8769,1 star for customer service and Trust team response. 1 week and counting for somebody to reply on submitted case and LinkedIn layered themselves so it impossible to follow up.
4e5bdba6-950a-402e-a951-7a18fb9c89d7,"For last 2 months I am not able to post pictures directly from my mobile phone. Whenever I open 'add a picture' in the 'write a post' option, 1.As I select the picture the screen goes white and nothing happen. 2. I also have to touch 2-3 time to select a picture. 3. While using Chrome browser for linkedin, while uploading a picture it gives an error that the operation can't be performed due to low memory. But have half of the memory of my phone is free, then why I am getting these errors."
a8a1c4af-b2ee-4191-96ab-9c2f7a27fd9c,"unable to start to verify email. I have tried it both on a computer and on my phone, but when it wants to verify my email nothing is sent. I was sent one six hours after first creating the profile but by that point I had already pushed resend so the link did not work. it has bee n 24 hours and I have only received that email. I have confirmed many times that it is the correct email but still nothing, please help."
cab47a1e-8095-4a09-a7d6-c80e98b8c148,"for the past 3 weeks i have not been able to use this app ..anytime i try to view notifications, check a profile , open the inmail, comment on people's post or check to see connection requests , i will get an error : "" NO RESULT FOUND. SOMETHING BROKE , SEEMS LIKE WE'VE TAKEN THE WRONG EXIT HERE. TRY AGAIN"". I've endured this frustration for almost a month now and after 3 updates too. please fix this bug for crying out loud. And i use a samsung j6. thank you."
45e76443-3054-49ab-a71d-7201b1c04eff,"This app is just a headache, everytime when I signed up they restricted my account, I have provided them my ID and passport as well but they didn't allow me to use my account so in my opinion they are just wasting the time. Instead of using LinkedIn a person should check for the related jobs manually 👎"
a3b25ddf-ed68-404b-b311-64db2fcd1102,"This app sends the most vague & unnecessary (random 'do u know xyz?', 'increase your connections' notifications on my phone. While other social apps give some insights into the notification using the features baked into Android (name of contact, nature of notification, the message from the contact, etc.), this app is intentionally as vague as possible to force users to open the app. So, I've disabled all notification access to this app. You can't force me to open the app for unnecessary reasons."
19f0efe6-353d-484b-b9e1-78d1afde2f52,"Worst app ever used you will simply waste your time on this rather than apply to jobs on new sites that will be helpful you won't get any response other than ""unfortunately""."
5d86850d-db6c-4212-87be-bd9a87675a15,"Randomly enables ""job alerts"" notification spam."
ce6bf5bd-7b19-407c-81a1-4f42637287f2,My LinkedIn was acting up so I uninstalled the app and reinstalled it. Now I cannot access my account. I've tried various ways of logging in but it's not working. I had to open another account to reach out to their customer support and raise a ticket but there is no response from them except that they are not available. All my connections are in that account. I tried opening a premium account but I am unable to that also.
630a2b5b-8f9a-4045-b868-122fbdfb6a44,"Annoying notifications and sounds, terrible notification controls and setting missing global controls."
8dfcfb44-5781-4b83-b24c-11aa4db7988a,Not able to login. Everytime asking for email otp verification. I verified using phone but still not proceedings. Email otp not coming.
af4c3bff-a599-412e-985a-b3587b2f3e3c,The notifications menu is pretty darn bad. It's incredibly slow and feels like navigating a very slow web page rather than a dedicated app. The checkboxes do not act as checkboxes and link you to another page filled with laggy toggles. It boggles me how bad this aspect of the app is.
416ceba6-907f-4740-9efc-8a5541c07922,"WARNING: Because I use(d) an outlook email address, this terrible linkedin app, now owned by Microsoft, steals Outlook app control every time I click any link in a LinkedIn email, & won't let go, nor allow me to back-up or navigate to read next/another email in outlook, sending me in useless circles within Linked-in app until I force-close Outlook Android eMail client app & restart it. It's a breach of Google policy and an awful way to harvest my private linked information; #BADsecurityBREACHES!"
1587683e-b97e-45bd-b4ba-a82f5f4d1236,"I don't use this app at all. It's just an annoying app that is installed on the phone and can't be deleted. LinkedIn responded but their reply might as well been in a foreign language. Still just an annoying app that can't be deleted. It's updating again, wasting data. Still annoying app that can't be stopped. It has an uninstall button but that doesn't work."
6a606184-f5a7-4e85-afd6-bada0f1d24ee,I can't login to my account. When I entered a 2-way verification code sent to my email address it didn't work. Now my account has been frozen. I submitted my government issued ID card and was told the picture was not clear enough. But I can't access the page for resubmission.
2c34498e-08c3-4320-9e10-a0c1a825cd4e,"It's pointless, it's no better than searching Google even with EasyApply you have to constantly refill out forms and if your mobile and can't upload a resume that's on your laptop don't even bother. Most listings don't even have EasyApply so every job you have apply to wants you to make a profile on their site and fill out an application from scratch anyway. There's no point to this, I've had it downloaded for a year and all is resulted in is spam phone calls from fake pages."
4b8840a5-6f45-4137-a1eb-3e3d059723db,Can u please immediately fix the document uploading features in massage. I'm facing this problem via using my cellphone. Kindly do the needful ASAP
92b8eb72-a08f-4f6b-888f-256ea63a5e3e,LinkedIn as a App drains the battery on my phone like no other. the reason is that it launches YouTube for all the embedded videos and then leaves it running in the background. phone heats up and battery is flat in less than 2 hours. LinkedIn has done nothing about this and I do not recommend you use the app.
c650ef3d-fe78-46a3-a015-fea5215434be,"Continues to notify me about jobs I've never searched for, in a field in which I do not work, after I explicitly turned off notifications for this not-search that I cannot delete. .... Update: After finding out how to delete the automatic search (not obvious how) that was automatically generated AND contacting the developer as requested, I continue to get notifications for the now non-existent search. It's stunning how bad this app is. I had to block all notifications from this app externally."
c71724aa-85c4-4035-9328-624fae207ac4,"Terrible. I can't even login!!! The app is forcing me to use Google account to sign in. I have had a LinkedIn account for many years and used via the Web without issue. However, I can't login to app as it says my Google account isn't registered with LinkedIn (which it' s not, I use a work email address for LinkedIn). No option to sign in any other way!!! Woeful, terrible. Doesn't work. Uninstall!!! Dissapointing as mobile access would have been nice."
be2ceee3-1d03-41b3-ad18-429620dcb079,"I've been using this application for many years, 7-8yrs and what I am seeing lately is strange and cumbersome. My linkedin application gets automaticaly deleted and represent with chinese which I am not able to access. I've uninstall and re-installed the application for over 10 times now but the same thing repeats itself everytime up till now."
9c9657bf-cb84-46fa-9b22-98600d882011,"My account got restricted due to some bug or mistaken reason and when asked to verify my identity, I uploaded my document and it wouldn't proceed ahead saying ""an unexpected error occurred"". I can't even contact the customer care because they require me to login for this or verify my identity but there is a bug in the identity verification page itself. Also, as a student user, I'm absolutely sure I couldn't have violated any terms and conditions, I was sparsely using the app."
14749761-ceb5-4f9c-a5e5-11f797d206dc,The biggest professional networking site has the worst app. The feed does not update no matter how many times I try to refresh. There are posts over 2 weeks old as the headline. The latest posts does not even register on feed. Posts that are completely irrelevant to me but someone else might have liked it stays on my feee forever and things that are relevant does not appear on my feed. Absolutely horrible worst experience using LinkedIn app
2b327119-9d5d-4ae2-90db-fbaeddc83643,"email said I had a message from another linked in user. everytime I clicked on the ""message"" tab, no message, but they kept trying to shove this app down my throat. UPDATE- 02,06,2019- Reply to LinkedIn app below- No, I will NOT send you all of the requested info because I'm not an idot. I don't like being hijacked when I click on a message link, I want to see the message. Ya'll know you intentionally routed me to an ""install your app"" page, instead of my message, in Hope's your #'s would rise."
d9545043-ea1e-4273-ab59-cf05b906509d,I hv to reinstall the app whenever I hv to use it. For some reason the app changes its name in a couple of days to Chinese....and then gives me an error that this app is not available in Chinese mainland.....I know i am using a Chinese manufactured phone but I am located in the middle east. This is really annoying and the only app that behaves like this.
f319f129-55f7-4edd-b2c3-3c6eec2b79b7,"Dear LinkedIn, I used to be a frequent user. Now, I have uninstalled it. The reason is, there are so many Privacy concerns. Anyone who is logged in LinkedIn can view my profile/email address and many other things and they can do whatever they want with this information. At least there should be option to hide my own information to ppl without upgrading to premium account. + The idea behind platform is to connect professionals but only if had been non-profit, I would have really appreciated."
d1bfec9d-8998-4105-9f32-b5372cc3d642,Getting expensive. The subscription so so so expensive. It's getting more expensive this year. Ez money.
7b8d2697-2d70-4120-b8dc-ccc9fbc4a1e9,"I deleted my account back in 2012, and they still are posting personal info about me. Also NO way to communicate with them regarding this personal issue."
91dd5b08-3d6e-4c32-84ba-d5b93ba181f0,Gross - A huge company like this and they do not allow you to cancel your premium membership on a mobile device - even on the internet browser. Everyone should report to the BBB.
aef24fa0-c04c-430d-bbb7-8f1d5c102290,Some one is hacked my account and massaging all people somthing about Ukraine and I changed my password 2-3 times but still someone is using my account. Seriously your security is totally zero. I can't even generate a ticket about it and you don't have a help mail id. Please if any one from team is reading this please contact me on this email and please resolve it. It's so problematic for me.
bc52de21-ecac-4b22-b27a-f4df01c23f9c,"The third and fourth tabs do not work most of the time - says ""no result found, try again"" nonsense. Sometimes react don't work - says ""couldn't react"" with a ""dismiss"" button. What a junk! Edit: don't ask me to send an email to you, coz I won't. Edit after reply: if uninstalling and installing is the 2 step solution you provide to fix this issue, I would rather take only the first step thank you very much."
c218e264-8c77-4ec0-9602-5c7c81612d81,"I've uninstalled and reinstalled this app, and there still seems to be some bugs. For example, if I choose a particular job industry, and select the location as ""Remote"", it loads as having x number of jobs but the page remains blank. In other instances there seem to be a lot of scam/fake job postings as well as numerous job repeats."
23abc2dc-9e8c-4783-9597-7443be08709c,"That's the third time that you restrict my account, it wasn't only one account , there were 3 accounts that had been restricted. This restriction has three different mails that are taken under USING MALIS now, they got expired on LinkedIn because of this restriction. I went to the browser as the message was sent, and it requires a valid id and I uploaded it. They haven't notified me with anything yet. I'm very frustrated. I couldn't make a valid account and I don't know why."
553f244c-7d5e-434f-a831-59403271bbc1,I am selecting the correct captcha but it keeps telling me it's missing and throwing me into a loop. Can't log in.
06c925d2-92e7-4cbc-90ea-9cab6bd9a16e,"linkedin on my phone is GARBAGE. Does not work!! f---king fix it!!!!!!!!!! Its consitently and always down. Cannot send or load messages. Cannot even like anything!! Keeps saying ""try again later"" on the desktop or laptop it works fine. Please fix this issue. Thank you !!!!! Has been happening for too long now and its really driving me insane. especially when im trying to communicate with a potential employer or prospect !!!!"
a3689731-8a79-4271-8627-343ee9e75873,One of the few apps that does not use the standard Android picture selection functionality - trying to add pictures from Google Photos to posts is almost impossible. You can definitely tell it's #MadeByMicrosoft - how hard is it for a company this size to keep the app up to date.
151bfd0b-68a7-4446-ab59-b75e154f75af,"I keep getting blocked and keep being asked to submit my Identity cards, this is so frustrating"
ecdddf6a-1d0e-4af1-864e-1c02f0136785,"How shiesty can you be, making it nearly impossible to cancel the pro membership. I'm not exactly new to computers or managing subscriptions for premium content for myself, and yet I spent 20 plus minutes looking for the option to be able to cancel the premium subscription so I'm not billed $40 a month for absolutely nothing. Never again."
6d1661ba-d357-4543-a7e6-ffd534cef228,"The app itself is fine, but the pricing model is absolutely ridiculous. The cheapest subscription price is upwards of £25 a month... imagine being so utterly full of yourself you charge a minimum if £25 a month for, what? To see who views your profile, or a little ""premium"" badge on your profile. If they had a more reasonable price, I wouldn't rate 1-star, but as it stands they are really pushing it"
46794eff-85b4-41f1-8c31-64169788b7ad,"Worst app.Deleted my account for no reason. I have no means of getting the answer. I have verified myself many times, but still no response."
