Review ID,Review Content
6c0c03ea-d42b-4087-bc65-7bef35dbcfe9,"Absolutely worst experience so far, first when I opened my account they never sent me any confirmation mail or text to my phone. I waited for hours, taped resend a lots of time but no response. I finally got to opened my account by clicking an option ""creat another link"" or something, I don't clearly remember. Now that I got to opened my account and after properly setting it up, I found out it's not visible to others. It's been almost a day but no change. Can't even find any solution online."
928402ad-3728-4b07-a7ab-d8ff6cade315,"After loggung in I am stuck to capcha, thougg I put the right input. It keeps going to capcha verification 100 times. Really disappointing."
4470ffe0-1cff-48ea-b80b-0d6532a28f2c,Your suggested posts are trash. I'd go to Facebook if I want to see unfunny stuff from ppl I don't care about
400fc162-f210-4e58-bc92-d4d95b558520,"LinkedIn is one of the worst dictatorial platforms. They have the most fake rules ever. They do not understand or are able to help people as much as they impose their opinion and their stupid rules without importance. They restricted my account a lot of times, and I explained a lot of times that I am just used my account to help people get jobs and never ever gained one cent. But I just insist on restricte my account because I share some jobs for specific gender or language. I fed up with them."
16565112-aff8-41b4-b43e-0a164eff18cb,"Hi LinkedIn, I'm really disappointed by this application, when I try to open the app it doesn't show me any feeds, requests , or notifications (it says ""something went wrong - we are having issues loading this page""). Being a student persuing post graduation, I think LinkedIn is most required by me at this point of time. really bad experience."
6b58e1c2-9260-4efc-9afa-3b358f822d1f,"I am very sorry to say that I did not have a good experience with your app at all. I was not getting any offers regarding the field in which I wanted to work. Another job offer was coming, and I contacted them on what's app that their work was different, I got annoyed by their similar messages, calls, and I didn't get what I wanted, I got trouble on what's apps, I am very disappointing of the services.."
145489ce-99c6-4d5c-ad54-495c5ec2d0f1,The most ridiculous customer service. It froces you to sign up for Premium and then it won't refund at all.
e7cd5fe5-6e23-499d-85c2-dff93f8d00fe,Your noCAPTCHA user response code is missing or invalid. I tried the captcha multiple times. What is this?
140731fe-15cc-4195-8070-e8b00bb0c376,"Facing issues with LinkedIn. Even after someone accepting request, it shows not connected."
6b8f33f3-2b0c-4da3-a7d8-6a57436d50ae,After the update - Unable to save the pics - & - now the notifications are not opening - ridiculous
04e5af31-233b-45c1-923d-1a90c5bf0b97,Very interesting and good communication
994fd2bc-502b-4ebb-90ae-e59212a06b31,The worst app ever the moment since this verification thing got in I got my accounts permanently restricted.. i don't know what's wrong plz help this is the third account I am creating now stupid app
624bacbd-2ee2-4ffb-a1fa-196ceb4ce9f5,Not able to pay for premium subscription
1bfbfa64-19c7-4cd9-9d70-b17ef410da33,"So frustrating. I just wanted to open an account. I did not recieve the code that they were to send my phone. So I requested to resend it. But they didn't send it. Then I requested to send the code via phone call. Even then they did not send the code. My phone number was correct. Then I cleared the data from the app and retried. Then there came an issue with its recaptcha. Though my answers were correct, it endlessly examine me with its recaptcha. And I could not open any account. Please fix it."
a70f06db-a713-4e51-9529-73945930b5cd,"Hi, I am not able to add background picture/card in my Android phone. It's not responding and the starting point comes everytime when I try to edit something. Please try to fix this as soon as possible. I have updated the app to the latest version.I hope you guys would fix this at the earliest. Thank you"
038c1264-ee89-4c2e-8020-81407a8c1bdf,Honestly awful. All the positions posted are not even in my country. No filter for a radius or local distance and all the recommendations I get by email and the app don't even correlate to me. I was looking for a long time and this app definitely did not help my situation. Your better off going to a companies site for which you're interested for hire or apply on-site/in store then use this app.
ecefdc6f-2c9d-442b-b4d6-89ef82592e21,"It was working fine then suddenly stopped being able to list invitations or post. Just stuck in an uploading loop with the message sorry we were unable to display invitations and sorry we were unable to post, try again. No way of contacting support. Just ""something went wrong"" and the options to try again or dismiss."
cfcc523d-12c0-4b44-a2b9-f76a52752118,"I've been a LinkedIn user, but recently my profile photo and those of other connections on my feed wouldn't load, despite the bandwidth of my mobile network. I have cleared caches, signed out, uninstalled the app and re-installed it back; yet this situation hasn't changed. It's downright strange! I use an Android phone. Solution or heads-up please??"
b83c4f35-7edb-48de-ac7d-56007a9006a2,"LinkedIn app's functionality is pathetic. 1. There's no option to mute or block offensive pages that a person's contacts keep liking or commenting on. It forces you to unfollow connections just because of this. 2. LinkedIn does not have a content filter and allows abusive words, statements from people. 3. The app is getting slower and throwing up irrelevant or old content on my home feed. The app and LinkedIn right now can be described in one word - pathetic!"
636e9ff6-cb7c-47f2-9aee-518b277ef919,if I could give 0 stars i would simply because you can do damn near everything from your phone except when you need your account reviewed for a refund. Then when trying to deal with it on a laptop its bunch of bs. they think its ok to take over $75 out of your account at 4:30 in the morning and make it almost impossible to contact them. i dont recommend this app at all!!
900d5315-6d0b-4892-a796-31f0f3599e3d,"When we want to create a page on LinkedIn, you force us to have this app. But the app can't save information about the page. eg, I can't put a logo on my page, the app is an epic failure in just saving a logo. Pity you can't create a page on the browser, so you are forced to download an app that fails to save information added to the page you're creating. It's a waste of device space for anyone who just wants to create a page"
609d3f13-944d-436a-84d0-3849bd7d9b9b,"I like updated version of this app, but every few days, app getting old version and Hindi language, which i dont know. I contacted support and they told me they can't do anything because i can't install Huawei version of this app in my contry. It's so annoying and i don't know what to do anymore. I uninstalled app few times and nothing, on app store is old version again, so i have problem again."
e8337d31-2942-4a2e-b7fe-1e4a6d6ff6dd,"I do not like the rings of fire that I am being sent through just to delete my account. I tried uninstalling, I still continued to get a ridiculous number of emails. tried to unsubscribe from the tons if emails I received daily, to no avail. I tried to minimize the number of emails I receive daily, to no avail. I want this app gone!"
6250a0a1-e4d1-438a-a446-871dafbca840,I am so annoyed every time I'm trying to post picture or a video it doesn't post it says there's an error it takes too long I have to uninstall restart my phone it will only post one picture or 1 video at a time once A-day and says it's queued like it says its processing but it doesn't post some very frustrated and I need to be fixed ASAP volume or I am just going to Delete this account and go to a difference social networking app
d3e7aa89-08c6-4e7e-b810-8ddcb573b6a9,"UPDATE: Found out that the issue appears to be with Blokada. Since the latest update, this program finds LinkedIn to be a threat or ad spam, so blocked it. Whitelisted the app and working fine now. Since latest update, you either get an unknown error or something similar, so uninstall and reinstall and it just won't login. Whoever develops this app obviously didn't bench test with Android P! I'm on a stock Pixel 3 XL with the latest update."
a6aff333-58b0-4b39-89c3-f6bafa96546e,"Won't login. Won't send verification email. Useless. Says ""suspicious login"", I'm logging in on the ONLY device I've ever used for this app. Makes me verify with code Sent to email, I've maxed out my code requests, still haven't received a single email. So I can't login without a code that yall apparently can't send me, even though I have my login email and password..... Utterly useless app."
32d3e11c-a02d-47bf-83d2-e0a77e0466d5,"When I accept an invitation to connect with somebody, the app makes a sound. I was accepting an invitation in the train and it was embarassing that LinkedIn made a sound. Also the sound is classified as a ring/notification sound instead of a media sound. I hate that. Is there an option to turn the sound off? I can't find one anywhere."
48ae4005-e1ad-4b1a-8e00-21444f4fc96a,No way to submit a support ticket. There's a glitch in my profile where I'm only getting notifications from one person. This is new since the last update. I clicked on several of my friends profile in hopes to reset the algorithm but it did not work and now I look like a stalker only getting notifications from one of my friends. Please add back the support tickets for weird glitches like this.
76c43fda-1589-47a0-a6c6-98a801ab06de,"""who viewed your profile"" still not working even if i joined for one month free subscription as well as linkedin today cut by credit my huge money without giving access to cancel subscription anywhere, I checked for it to unsubscribe but showing my other premium apps only in list but no LinkedIn it itself hidden in subscription list somewhere, and today cut my money. still I cannot see where it is. Still it doesn't show in my Google account subscription list to cancel unsubscribe premium option."
3370cd67-8939-42a6-85da-39e9daa8ee55,Instills confidence when the app doesn't work and nothing but form letter responses to comments. Clearly can't hire qualified help if it's broken across the board. Customers obviously matter enough to not respond after weeks broken. Really justifies pushing pay version so much. I've always found it glitchy and unimpressive. And don't bother with the exquisitely helpful canned response. It's a waste of pixels.
d3888912-86e5-4932-a373-bb6108cc6661,Thought LinkedIn will help me finding internships and jobs but it is not that useful. It never shows any genuine jobs non of them were verified. It is just like facebook. It is not helping me at all and also constantly asking for premium version. After using this app my suggestion is that if your a fresher don't go with it app instead search jobs and internships directly on company's web sites that will be lot more easier and convenient. Other wise you will be trapped in their vicious cycle
81f1627c-9a19-4164-bd6b-4108dd751143,"A few weeks ago the app got weird with a permanent message on top of it I could not get rid of it. I decided to delete the app from my OnePlusOne. Now I have this ""This app is incompatible with your device."" and from my laptop I see GooglePlay is telling me the app is installed while I deleted it. What's wrong? Why is the Linkedin app not working anymore for a OnePlusOne phone?"
fbc1e627-b2c4-4aa4-bba6-77cf55e5e65f,"what exactly is this app for? i'm looking for jobs and i get social media posts, profiles and ads. can't even change the language of the app without changing the language of my entire phone. i search for a job in my city and after a couple results i start getting offers on the other side of the country. even the website is a complete mess, i search for job offers in milan and get results for naples. finally find a good offer, try to upload my cv and ""something went wrong, try again"""
4a939c0d-e169-4cc3-8265-ef322778592c,"After 6 month of premium subscription, it is a waste of money. The most important feature which is InMail is limited to 15 messages ( 5 meaasges every month), so if you are saving them you will get only what makes them 15. And they are not clear about this policy and also doesn't make any sense to limit it. Customer support are dependant, always offline. You will not be able to remove your payment details without losing your current subscription although you paid in advance for 30 days (Phishy)"
6f457d94-6361-4053-be3d-86800d1e87d3,"I have been using that app for MONTHS. One, it never shows jobs in your location. Two, the team spams you with messages just to keep you coming back in hopes of it being an employer. Your better off searching on google and using snagajob. At least with them, i actually got interviews and found jobs in my area. Linkedin really makes it harder than it needs to be."
ff680c4d-2f83-4f53-be3d-ab7e2e4bd2bb,"App not getting updated, hence it is not operating. Please give proper instructions to update the app. The support is worst ever I have Seen.my mobile model is Samsung tab S3. If you can solve the problem on this information please do it, otherwise cancel my membership. It was already running fine. Due to this update message I am not able to use it.the update screen of play store says that this app may not be optimised for your device. Thanks a lot. Today the app got updated and is working now."
da6a505a-0686-4a51-9f94-5b5de6ed75e6,"It seems LinkedIn PC app is having issues. My article saves only half. Whatever i write futher just vanishes after saving. Reinstalled the app in PC, still the issue is not resolved. Neither its saving nor publishing. Very poor support. It happened again, half of my article is gone when published. Pathetic support by LinkedIn."
eb3f4c7b-7ffb-4755-882c-71adc2d9c6c5,"This linkedin works very illogically. After joining 1 month and i tried to connect to many old colleagues and friends during this period and reaching about 500 contacts, suddenly the accounts stopped without reason and asked me to change my password more than 5 times and then said your account restricted without me doing anything against media policy and then i tried to contact admin but no way and then trouble shooter and no result and i submitted my passport copy in different shapes to verify and every time saying we cannot read your ID and so i got fed up and uninstall the application and i dont recommend to anyone to use it. It is a waste of time and energy. All rubbish"
afcca376-ea3c-41d1-95bb-e99a52d0e15d,I subscribed for LinkedIn premium free trial account and soon I notice that they withdrew 1652 Rs. from my account without even sending a reminder mail about the LinkedIn premium expiry date. Literally is this your customer service. Can't you people at least send a reminder mail to inform your customers about the date on which the account is going to expire so they can decide whether to continue or not. This is a new way of looting people. Good job. I purchased thru debit card.Give reimbursement
d71c53bb-a0cf-47b7-afab-fb992da5fb9f,"I'm sadly disappointed with LinkedIn. They no longer cater to the job seeker, but instead cater to the advertisers and premium account holders. If you are a job seeker, without paid premium status, LinkedIn is no longer the service to use. I'v used LinkedIn for over 3 years and noticed during job searches that some job postings I never see. The unseen jobs are perfect fits for me, and should be on the top of my search list. My career is too important to depend on LinkedIn. I now use another AP."
5450fe90-ed1b-4a78-85db-9d8070c2fc28,"Disappointed on the refund process, it's been 6months now since the last time I try the free premium, but didn't notify ahead of time before they renewed. And it deducted without user confirmation. I requested the refund and I am awarded to refund the unuse premium. But too long. Until now no refund. I email more then 5-7 times I didn't get any response. I will give my 5rating once the refund proceeds done."
6496b913-ad78-445e-a4d1-5e1b0fa95bde,"Too many years trying to see this app work correctly and nothing. Uninstalled, reinstalled: no controls to make corrections to what was typed. ~ stay uninstalled. T Mobile, Samsung, Android S, ver 12. I am living a nightmare, for the first time, I received installation intructions - in spanish ! .....I cant believe this....!"
ac97f125-7488-4cf8-ba8f-9fe0bcba93d6,"App covers the basics of LinkedIn, but it isn't worth the download, use your web browser Feed is the worst of any social media platform. You will see the same 12 posts for the next 6 months with a handful of new ones. How can you keep up with your network when the app only shows old news (aka ""top posts"")? There is zero care in improvement since the same issues 3 years ago are true now,they make it difficult to give feedback, & then never responds if you reach out"
a85359de-aa9c-4fb0-8383-e49579005a41,Doesn't work. Used it for ages but the last 12 months I haven't been able to access it. Messaged them and playstore. No response. Keeps saying needs to update but it won't do it. Cleared cache. Still won't update. Uninstalled and now unable to reinstall.
da2a1de9-f3fe-49cd-9ad3-842f29cb538b,Horribly programmed. It tries to verify the user through text but fails repeatedly. It cant create an account through the latest versions of android or chrome. I was going to check this out but you've lost me for life. Whoever programmed this should be fired or sent back to college.
a129e8b7-f6f6-4d4e-8d9d-c7b739231d5a,"I loved this app UNTIL you added stories! What were you thinking? Please add a way to turn off the feature and remove the dead pixels from my home screen. I reverted back to an older apk to avoid the whole issue. You are not IG, Snapchat or Facebook and that's why I love LinkedIn. But that one feature literally stresses me out. You have a good thing going, don't mess with it!"
c6e98073-166b-4032-986a-d24584187314,"Okay app. They force ads on you disguised as messages from an individual from a company that has opening for people with your skills. It's exciting until you realize it's just a blatant add and they are automated messages to make you feel like your important and desired by a company. None of message ads are directly relevant jobs and you cannot contact the ""person"" or company that messaged you. One click applications are bunk and someone just messages or emails you to apply directly."
1de64d8d-5a34-4ed5-b536-4b260bac0c74,"It would be great to filter jobs by language. The idea that a language is a prerequisite for every job listing does not make filtering jobs listings by a wider geographic reach as ""World Wide"" rational. Having job recruiters have to submit the requirement languages for the job will make the application process more efficient and fast."
f8124f2e-c03c-4043-9a64-622632855642,"WASTE OF TIME! Tried to setup my profile here on this ridiculous app which kept throwing questions after questions to help them indentify which is a freaking traffic lights, busses, cars, mountains, crosswalks!!!! I literally had to do this for close to an our. Tried a different account and guess what, its the same damn thing! Absolute WASTE OF TIME! NEVER EVER INSTALLING THIS!"
d0cec03c-697f-4ac7-a01b-db13a27396f5,"Most depressing app!! I was good as long as they had separate app for job search. Once they integrated it with the main app, I cannot scroll through without feeling terrible about myself. Atleast, if there was a filter to see only job opening posts it would be good. Their stupid infinite addictive scrolling only makes me feel bad everytime I open the app with posts from my colleagues boasting certification and awards. Please ask me what I wish to see before I open the app for peace of mind."
bcb64530-19e5-47a7-b11f-0088bfe050f1,"It's forcefully installed on the Samsung Note 8 phone. Storage that I've paid for is occupied by this software and I can only disable it, not remove it. LinkedIn web site constantly pushes you to install their app because they can gather more user data. It's not fair or respectful, avoid it if you care about your privacy or freedom of choice."
45f9775c-4bcd-4832-ade4-d2ef0215ce3f,"Bad app and has the worst support team. My account was hacked and no one helped me. I've sent them my ID and everything, but none has recovered my account. Most of my network has reported this hacker who has changed everything and kept my old posts, but nothing was done at all. I guess the support team is only Bots. Keep away from this app as you won't be safe! Once you lose your account, you would never get it back."
71d24bcc-f9ef-45b8-81ac-44baa86695b6,"I did love the app, but for months now it hasn't been working i cant post i cant see messages nothing it keeps saying error retrieving etc. i understand its beta etc. But I think that I will be deleting this app for I actually would like to use my LinkedIn account and with the app not working I have to go in via internet anyway it's taking up space on my phone now. It's a dead app."
7477cb0c-c94c-44b1-bf05-4330afc3bb50,"Good evening LinkedIn, My LinkedIn application has been showing a Chinese logo for days now and I downloaded it from playstore but the chinese language do not show immediately but after some hours when i have installed,it will display the chinese language under the linkedln application and I will uninstall and reinstall it back on my phone it keeps showing.However,when I click on the application it shows an update and when I click It refers me to a Chinese Website,which I don't understand."
3b0e1c50-cefc-409d-8524-6acd42c3c09a,"I'm only installing this to give it one star. The sheer existence of this app has made it impossible to use links in LinkedIn emails from my phone, like ""Accept invitation"", because the link gets hijacked and redirected to Play Store instead of going to the website. Thanks for the reduced functionality. No, I don't want your app."
61aa62cb-ef92-4bcb-a75c-759959d7d8ad,I click on comments to see comments on items that appear on my feed but it fails to load them. Items that appear in my feed often make little sense in the order they appear for example when someone gets a new job that should appear on my feed but then it will be at the top of my feed again randomly say 4 weeks later. Google Pixel 3 with latest Android update.
951060ff-7dec-4d4d-8305-ab2df1ffdd9d,"what kind of backroom deal has samsung signed to get linkedin to be on of their manditory downloads, just bought a new A8 and cannot for the life of me permanantly uninstall linkedin every time i uninstall linkedin, it installs itself again automatically, even if you have auto update off it just reinstalls itself overnight, what do i even do in this situation?"
46071fad-6210-4b6c-b53d-10683c1c99be,"I've uninstalled. It used to be ok. It's gotten increasingly intrusive and obnoxious. What used to be an app for a professional network has become just another spy and sell program I had no hesitation in deleting. When value is low and obnoxious is high, deleting is very satisfying."
eebf187d-45f0-4840-b409-eab41452701a,"It has become impossible to manage the feed. Constantly irrelevant promotions and unimportant activities (eg. likes) from my network. A social media feed is not adequate for a professional environment. No way to understand what the algorithm ""thinks"" of you and how you can adjust it. Totally intransparent on how your data is handled. Job search is ineffective, only contacting recruiters makes sense. I have LinkedIn premium but no extra benefit other than LinkedIn Learning. Deinstalled."
c31e0d74-0995-44e3-8e00-d21a68cb7ffe,LinkedIn Please refer olx or some other applications that if we want to hire an employee using your application we should be able to create an alert where a person just by clicking that alert can apply and we can communicate with him/her and hire. It is very difficult to find a person who is in need for a job and suit the position that we have in our company. To find people who are in need of a job in nearby location is also difficult.
925dc9f0-cd6f-4830-852f-a9081108f1eb,"I was charged an *Annual* subscription fee *without* prior intimation, while the subscription page stated a monthly payment scheme as well. Why was I not asked before such a HUGE amount was deducted? (The amount is also higher than the annual stated amount on the page, without any justification provided.) For many, looking for jobs means we *cannot* pay a huge amount at one go, which is why we are looking for jobs in the first place. Please note the fallacy, refund and allow *monthly* payment."
2a6e3d36-80c8-4e5b-9a8a-76970cffaab6,"Linkedin is now nothing but ads and bugs. Ads every after feed from my connection. Never imagined LinkedIn will go this low and desperate. Also, as simple as hiding a Job ad/post, LinkedIn can not do it. I hid several irritating jobs in job search but continuously appearing. VERY BUGGY app, and the engineers maintaining it are not doing anything. In addition, it has a lot of unnecessary pop-ups which degrades user experience."
bfac48fc-c8a6-4838-ba49-32cfd4394616,"Dear LinkedIn Team, As you can see, my full name is 'Abhishek'. I do not have a last name. But unfortunately, leaving the last name empty is not allowed on the LinkedIn app. All the app's features push for inclusion and diversity but unfortunately, it doesn't seem to inclusive of people with just a single name. Please fix this. Edit: Still awaiting your response"
