reviewId,content,score
247effa4-9ab9-4c1b-a0ba-1d231ce646a5,"Your algorithm keeps feeding you the same content in different iterations to promote endless scrolling. There's so little variety of viewpoints outside your preferred mindset. Tik Tok started out as letting you see the world, but now you just always see your ideal world through a screen.",2
965cd03a-f66b-4421-81f0-0e8aac1a9574,"Look this app is great okay, But this is getting way too out of hand. Why in the actual earth is this small app taking over 2GB on my phone!? I would use TikTok lite but it is trash compared to regular TikTok but you need to stop saving useless files from the app On my phone.",2
0e517ce8-f1e4-4cda-85a1-629b6a9dbbdb,"only good thing about it is that there are fun content creators. recently, its been saying ""unstable network"", etc. my internet is perfectly fine!!! it doesnt even let me watch a single video. i tried uninstalling, redownloading, closing and opening the wifi, and seriously a lot of things. no, it still doesnt work. whenever im bored i always go on youtube shorts as my only option. i dont like youtube shorts and i hope you can fix this asap.",2
dfbc0b85-e12a-4431-b0c0-57db04d2e334,Tiktok is a fun app but I am not able to open it for atkeast 7 months now. Sometimes it works for a few days just so it doesn't anymore for a few weeks. Even uninstalling and downloading it again isn't helping,2
799da9a4-8812-4496-8860-f1eb7c550ccd,"I had the Creator Studio version, had to uninstall it and when I installed it back, it had dissappeared!!! Now I cannot edit nor add voiceovers.",2
5e253200-4fbc-4973-b68c-5a147ccbd498,The slideshow feature on Google pixel doesn't work. I can upload photos but I don't get the option to make it a photo or video. Tiktok please update this!,2
0ffaa175-e526-48cf-affc-48eed9ca9e85,Mu dextcto speech disappeared for weeks now ... difficult to get support with issues u. The app ... greatly shadow contents with no clear reason for shadowing... app keeps limiting the growth of my page by capping it's views ...,2
ccc4c67b-3217-4e38-93a4-6326e7ae4cd8,"The new Temu store. Ive been a fan since day 1, it was a great app that became a reliable part of the day. Recently ive given up on the ""For you feed"" as its just page after page of people selling the same cheap tat with expensive postage. Tend to just check out any new posts from people who i follow. Then leave for youtube shorts which i found looking for a replacement with the variety i miss from the early days",2
19ffa772-a532-4111-8761-3d5fb664d783,"I've made a new account and when I try to set up my profile it keeps on saying ""slow down, you're editing too fast."" I can't follow anyone's profile too.It's been 2 days since I created the account but it's still not working.",2
43b6c54f-1479-42bb-bae9-30fc5247843a,"The app gives me great videos, but for the love of god, where is darkmode. My eyes burn using this app and everywhere online is saying I should be able to enable dark mode but the setting is just not there.",2
d6320b1a-1b38-4b16-8ec8-09f1e6b320f8,The following section where you can only watch the creators you followed keeps disappearing and bugs everytime no matter how many times i reinstall and restarts the app.,2
d196729a-ee8a-4014-ba45-9e0a96d62e2c,Had tiktok since 2018 and its been a fun experience really fast and fun but then it became extremely buggy on every one i know with Android devices and its faster on Iphones for sum reason its kinda unfair.,2
011b4e79-e390-4c8e-858c-4b995ece0743,"Another bug in this last release, screen transitions are all over the place when the user backs out between profiles, videos, activity, everything. S21+ on OS 14.",2
07d32fbf-5c1f-4bcf-bb89-a85edec2eb27,It's aight but today I just lost my account with 700 followers when I was switching to it it said invalid peramitors idk what that means but it did that for all my accounts and I'm so pissed rn bc I don't remember the password but I changed it with a Google account but it says the Google account is not registered bro I lost 5 months of work because of that stupid thing,2
8b556c15-8429-4ce5-be4d-e69332cb32bb,"It was such a good app but the updates screwed it, i cant even find good filters and when i see a tiktoker using a cool filter, but thers nonway i can find that filter, tiktok is not even displaying the filters....",2
74502e7b-5a63-4f7f-bbbe-6e6b36b90f39,I love the app but the only problem I am having is that the app keeps removing the sound and music I choose and it really annoying.,2
1241e4a8-96be-44cf-b878-305e02e985cd,The spam filter ruined the experience. Whatever spam technology update that just started is up really is making IG IRRITATING. I'm just exchanging tips and advice on a post everything has been flagged multiple times as spam and deleted,2
5021600b-f1eb-4351-a606-d3f4cb57616b,"The 'follow' tab no longer exists. Is this just a problem with my app, or is this part of a new update? Can no longer just swipe right to watch the content from the people who I follow.",2
990f76bd-bb39-4ded-a112-1c581ec9978a,"Audio syncs up fine in tiktok editor, but then is off by a whole second after posting video. Also...all of the shops inquiring for collaborations ""shop details"" page is going to the same link...the button takes me to the same shop, no matter what shop it is.",2
035309ce-f07e-41c7-ace2-4ea2d659d103,It's so laggy for no reason and sometimes when you film a music video the music doesn't match to the lip syncing 🤦🏽‍♀️,2
49b24313-2bf7-4c48-ba0e-fdc3d2f72957,"Hi, whenever I try to open the app, it glitches and doesn't open! I have updated it severally but to no avail! Please try and fix it.",2
ab214e35-a05b-43f1-847c-aab72fb09376,"How many times do i have to update it.it glitches so much.plz do something.... nowadays i opened it ,it gets closed , doesn't response, can't make video music problem, doesn't start on time.... ... totally it's making so much problem.",2
fbcb4d27-bbe4-4399-a1e2-aecefb661c55,The duet feature is not working properly. The speed is too slow. The mouth is not moving with the words.,2
4953af27-44e8-4b6c-b51b-ed57bdcdb5cb,Why is it now saying my device may affect it when it never has before. Plus it never lets me know there is an update and someone said you have to uninstall them reinstall to get updated.,2
71a3a364-6920-402f-8a08-07ad3a2894b5,3 stars because algorithm sucks. Reporting videos that are against guidelines are not properly evaluated. Lives will randomly get banned for age restrictions when creators are 18+ and other unknown reasons. The for you page is mainly shopping promotions instead of actual users content. App is addicting and semi-educational on the plus side.,2
d882643e-a687-4592-b36f-8f43a8803298,"Im giving 2 stars because the app is a great idea. However, every other video is christian bs. Then the conspiracy theories. I spend more time blocking thean I do watching videos. You will be bamned if you use words like ""Ew"". Yes!",2
668271c6-4a7f-42b1-b7b8-847268104b3a,"From a content creator stand point, they don't want you to make content. From a viewer standpoint, they do t want you to follow people, bc they make you auto unfollow random creators. Other than that, 10/10",2
7b20c7d3-b8a6-4b75-84b1-74a18a482005,"I'm using it since 2 years now and I can't use wide angle camera, sometimes I can't open the app an I have to reinstall it. Adding to this it's buggy asf. Now I logged back in my account and all my drafts are gone",2
0208a51a-6aed-4206-ae8e-8abbe6b235ea,"Since the last update, it keeps crashing, and I'm not even able to open it,I hope it gets fixed,I'm uninstalling and re-installing it to attempt to be able to use it again,please fix this",2
9067be9a-0036-4a32-b619-09455dccc214,Used to be 5 but now it's a 2. Now when I search it shows the videos but after 3-5 videos it shows random things that's nowhere near to what I looked up as if it's becoming my fyp,2
c15fc42d-b7ec-4cd3-bf45-64a493e5fc0a,Frustrating and too slow to load both TikTok and Tiktok Lite are the same thing the new experience is very. It took much time to load !,2
7d2144ae-2bbb-4766-9e1a-e8a80345a3bb,The live videos are poor quality. they keep cutting. You can not hear what the person is saying. Poor connection,2
32ccdc35-8746-4ab4-be06-42acc4e294f6,"I loved the app when I started on it, I found lots of like minded people but lately it has been terrible, the censorship on lives is unreal, innocent fraces and questions forbidden and you constantly see the same videos even though there are millions on the app? I know lot of people are giving up on the app because of it. I hope you change it back or risk loosing alot of views as you know people get tired soon on things like this if they are too strict.",2
bfd65461-1e03-456d-99f6-a479cf4a33dd,There has reacently been a problem where whenever a slideshow comes up I can't see it it just goes black and the soud is still there but I can't swipe or anything,2
b18a6df5-9959-4da0-9489-772353710e0c,"Love the app, but the last few updates seem to have made playlists completely disappear from any and all profiles.",2
3e7dea2f-af4f-47f4-9b8c-7c6af37a7915,It has tried but am trying to follow people but it refused why and even my videos only get 100 and going down views why even I have tried to text the help center but they refused to reply Tiktok please make my account public for my videos to be seen by everyone that's why I'm giving them two stars,2
ee5fc9c2-8dd6-41be-a2f2-2b527a197cca,It's very addictive and there are some nice ppl and u could make friends with ppl but there are some ppl who are rlly toxic and they will always try to make ur life a living he'll that's why some ppl quit tiktok. But some ppl are rlly nice and could become ur bestie some day but so many ppl quit b/c the toxic ppl. Overall it's a 3/5 stars I would bump it up to a 4/5 is u could send pics in chat it's irritating. [Edit STOP TAKING STUFF DOWN THAT ARE PERFECTLY FINE AND ARENT BAD TO POST IT NOW 2/5,2
489f1272-20de-4d05-a7e2-322db76a3106,"Was good until they moved US users to the US hosted version of the platform. Now, it's all ads/shop/promos and no way to report fake accounts that steal content. Also please add Dark Mode for Android users",2
359029bd-06b6-4479-8cee-d6b57416fc1a,"I like the app for the most part, but there are so many bots and more like my videos every time I block them. I've blocked about 30 bots, and 20 more liked my videos.",2
2edf5a9f-bced-4d59-8f52-3d54ff8a6871,"Its good and has content, but NOW when im trying to post videos they dont want to and sometimes pop up, and if i try to post something its just staying at 60% uploaded. Fix this.",2
3b81dca4-2672-4aab-93f4-894c2c1baec5,"It was ok for a long time, now out of nowhere kicks me out of the whole app or freezes then refuses to let me back in the app for a while.",2
e83cc801-0fdd-4d20-bf97-97a1759b6d96,It takes to long for the app to come up an when you are trying to type a message to someone it cuts out half way through the message,2
d1ba4009-a6cc-4cde-95ad-04d0005f72e1,I no longer and like peoples reposts and can't comment makes a comment when I repost and it's frustrating I have people liking mine all I can do is nudge and iv Googled everything to try and fix it. Love this app but this sucks.,2
7a355faf-28b6-4727-9941-f14f6bf51bc6,The visual transitions every time you click inbox and activity are horrendous. Put it back like it was,2
c012943e-a9b7-4609-a82e-d8bdd4654fa0,Hi there. I am working very hard on tiktok to make very nice content. But from 2days my videos doesn't got any views. Please make it unfreeze Username. baooji.talks,2
b11705f3-bccf-483a-81eb-92ecc0c8bad2,Too much freezing and buffering. I can't enjoy the app for all the interruptions.,2
8f6e7283-7f00-42e5-89c9-fa694afffd12,"I love this app but I can't use filters, sounds, or make a video without it saying sd card not available. Can anyone help me with this situation?",2
f8a63309-23e3-4b9d-9077-91f17f3afcc5,I like tic Tok but I have a major issue with hackers. If the app doesn't do something about this problem ASAP....I'll find one that's safer to use.,2
7dbffc71-2d79-4919-ac5b-7179e766563e,"STOP asking if i want to sync contacts. i said no last week, i said no today, and i will say no next week. why do i keep getting this popup after giving the same answer repeatedly? it's beyond annoying. its disrespectful. i made my choice, now accept it and leave it alone!",2
cecfaf65-6fa8-407c-b421-07a507df6dd0,Whatever the latest update that has occurred I am seeing half screen videos which is cutting off half the content in most videos and blacking out comment sections this was not going on before can this please get fixed,2
9ac1a744-e4ad-4954-9c50-ff07eef5762b,Fun to watch videos but notice alot of people falling for false information. This app seems spread delusions and alot of race problems and hate. Social media will be our downfall,2
fb611a0e-bcb3-46e6-adf4-c1e43aa1c0a1,"App sometimes doesn't open,also freezes and stop working.It closes without my permission while trying to view.Takes time to open",2
17a9b9ca-7802-4d0b-a8fb-846b8b5abed1,"Whenever I want to create any slideshow, it doesn't let me do a slideshow. Please fix this. Thank you",2
5c435248-4cba-4e2b-97bf-e1b49d7e09f1,"I liked the app but there is this new bug, sometimes when I try to open it, it doesn't work. I have to reinstall it every time.",2
0c56c3fd-6745-493d-b657-dc80c95c6261,"I tried signing in with multiple accounts but it's not working, it's almost like the app is flipping me off and I'm annoyed.",2
b22d6db0-fcaa-4332-9d6a-fd732d9af148,This app is way too overregulated. I had to delete it and cannot support it any longer based on what is deemed inappropriate.,2
3342b92e-e393-4ee4-bf98-607ef5c00f97,"It's starting to get on my nerves when you delete my comments, under the pretext that it violates the guidelines, when sometimes the messages are just emoticons, moreover you don't even mention why, and in contesting we can't even write a message, and still you give yourself the right to interpret my messages as you see fit, what right do you have to do that? There's an expression that goes: I'm responsible for what I say, but I'm not responsible for what you understand.",2
9579344a-6e1b-404d-ac80-3cade7022e2f,Tiktok was going well until I tried opening it but it kept on saying stop I don't like that it's glitching and it logged me off of my account this is a big problem I'm gonna report if this continues,2
984a3406-5167-4e1c-ba83-da68b3c27318,"overall my experience with tiktok is good, because it allows me to reach and connect with more people. it allows you to reach more audiences, and customers.",2
eacab423-934a-4ed5-97e5-957cf3490cd9,"It used to be great, but then they had the audacity to add in ads at the end of some videos, Youtube style. Since then, there's but been so many bugs; audio from the previous tiktok carrying over to the next, glitchy videos, audio playing in places where it shouldn't. Overall, not a great time",2
d47eb1ff-8499-4219-8760-9eb6ee4b4f83,Not sure if its my phonenor the app but every time i get on ge screen blinks and then goes completely dark on the fyp but not on my follwers page. And the lives ALWAYS skip when im watching.,2
a0cae5d2-3f29-41b3-be4f-7a232fc4c3ac,Every time I try to buy something shipping is 10.99. I used to get shipping fees for 3.99 and now it just raised the price. Going pack to AMAZON.,2
4263bd18-ae91-4ba7-969d-c688ab8a26e8,Some of the features don't even work for me like the notifications section I can't see anything and the story option completely disappears and I have to swap accounts to get it back,2
3d5d890d-cae5-46aa-8225-440180a120b5,"It won't open on my tablet, it's K12 and updated new tablet 3 weeks old but ever since I got it the app won't open on my tablet,I wipe cache and uninstalled and reinstalled but will not work. Worked on all my other devices.",2
092c823a-3f06-499c-9272-9fcc48003433,Way too many ads. Ads start appearing when not even scrolling. Then it's 2 ads back to back when scrolling. Tiktok shop is annoying as well.,2
0903af12-97f2-4789-819d-6ebb94960a92,Can't watch lives since last update. Hard for older people to do videos and lives. Get live use removed without warning. Hard to fight to get back. People aloud to clone and use are videos to trick followers and friends .,2
853f7021-119e-4f0c-be92-76be3e1f4215,I'm getting very frustrated with this app! I have been unable to see anyone on live or see who is live for over a month and I've submitted several reports and nothing has been done!,2
4e87578b-f4bf-43f8-a462-3f4a610126f7,Getting old having to watch 2 skits for one small message. Next thing you know the person performing the skit is all over your tic toc. It gets boring and old really fast,2
6e4616f8-7eb0-4d8a-9e31-0573b2d531fb,"My following section disappeared in the latest update, now I only have the fyp, explore page, and the shop. This is ridiculous and I'm really tempted to just delete the app.",2
551b4b94-2cf2-4d8e-b5e8-59c707ec7764,"The app is entertaining, but the moderation lets a lot of hate speech and misinformation go on. Probably deserves to be banned if that doesn't change.",2
7df75467-3dbd-4881-88d0-fffcc1d40655,"Constantly getting served content I keep saying I don't want to see. Constant irrelevant live videos, topics and creators I've marked 'not interested' multiple times, ton of spam garbage and reports that get rejected. Way worse than it was six months or a year ago.",2
ea11a442-d13d-4000-b5eb-ab2d952e0874,"What part of; 'not interested in ANY live videos' does your algorithm not understand. Always click on it, then 2 videos later, a LIVE video.",2
5b07ba2f-82e7-465e-8527-d0e4ceb7cf1e,"I like the app and all, but it won't let me login because of an unknown ""suspension"" even though I haven't been on the app for nearly 2 weeks and haven't posted anything in awhile",2
ea05020b-d536-45ea-b314-a83615f8da9b,Hi I love this app. I just have one small request. Bring back the old reposts please..I cannot live with the new repost. You guys have been adding such useless and bad updates lately. Why? Can't you see how many people are upset about the updates? And you just won't change it? Please change it. Especially the reposts. Dont make new looking reposts just bring back the old ones. Where you could comment on your repost and see when other reposted. Please TikTok. That's my only request. Thank you.,2
416fd5ee-2016-42a5-b69f-edbc5b67f87a,"The app was working fine until all of the sudden it started to crash all the time. So I erased the cache and data. After that it worked but only until I closed the app, then it crashed again. Now I am on a loop when I tried to open the app every time. I always have to repeat the same process to open it. I also tried uninstalling the app and installing it again but did not work.",2
c018c6fe-fab7-4bb5-996a-59d05347e0f3,"App keeps freezing, when trying to upload it closes and it doesn't have a feature where i can link other apps after changing to business.",2
738675c1-8433-4ee9-a7c3-9f95cbf29cdc,"This app was really great back in the days but nowadays you upload a video and it's quality is extremely fake, very blurred and when you download it it's even becomes more fake",2
a16570e2-98c6-49ab-b4b2-31de60b99a98,I face some problem on TikTok .on my tiktok allowe high quality video option is not showing please solve my problem. Thanks you,2
9fe8eec6-6327-4f3d-87d0-fc740aeae3a5,"I've had this app since 2019, I reviewed it in 2021, spent hours on it each week, post on it frequently, but genuinely, there's too many minor issues I have with the app to state it all in one review. But really my biggest issue is just the fact there isn't a dark mode for my Android (s10). By this point, it's actually ridiculous that not all devices have this. Each month I check to see if maybe, by any chance they've added it, but I'm always left disappointed and annoyed.",2
56f41f72-1a60-46fa-b08d-324f46d5c8b8,"I really love tiktok all the videos are funny and the music but pin comments, filters are all gone and I do not like it , captions are gone like :/ yeah green screens and games are fun but not everyone wants green screen and games some people want to have the beauty filters. Like me But I do like tiktok",2
6a3f0b1c-eafd-4b91-8891-1919513d520b,"I found lots of issues recently when editing videos. If a sound is added as a recommendation and you edit the video and then realise you dont want that audio, all edited gets deleted. If i leave the app for a short amount of time my editing will get deleted. Trying to type anything is delayed and isnt working properly at all, please fix these!",2
063fe0d4-3cba-4832-81d6-0e27d525c76b,"This is no longer great, the list of things that don't work properly is long, and it seems that every update brings more issues. From block accounts that you don't want to see and still they appear to don't show me this or this creator just to get the same sound and or creator 20 videos all of this after clicking on do show me this or blocking the account and closing out the app. Kinda pointless to complain but it sure ruins the app.",2
e9fd3c12-a5a9-4c84-9d1e-d45dbff6c5ab,"Good app, recent update does make it very hard to use with the comment section coming from the side; this is very awkward to use and the ""heart"" symbol clips through the text often.... Using Samsung galaxy fold 2. Will update my review once addressed",2
6b7c1882-7c6f-46c6-b680-06c832d3f8eb,still not understanding why this app has been around for years and it's missing basic accessibility features like dark mode for Android and the ability to disable autoplay. y'all take 50% of all gifts given during lives and you can't afford to include disabled people?,2
53d4abb0-f36d-41bc-b6e8-b1cc6e57ae30,I enjoy scrolling for hours on end but I can't FLIPPING SEARCH OR FOLLOW PEOPLE I have gone threw every yt video ever on this and I cant find anything if I click of someone's profile nothing happens and the search bar doesn't exist.,2
9a8723dc-7a97-4e4e-975d-23fd72ac606d,"Fun to watch, but I would like to put out that the community ""guide lines"" deleted all the photos I had of my dead mom and my childhood.",2
0bf1547e-6867-4605-9f45-573b5de66560,"This app started off being really good but now it's just trash. Every time I click on the app it won't open and when I try tapping on links it just stays frozen on the logo of the app. Sometimes it doesn't fully open, it will freeze on the logo 🙄🙄 so not worth it.",2
53788a74-60fc-4b9c-be5c-7f32a0619f6a,"See id give it a five star if you didn't delete half the music that is on tiktok. This update is the worst, what are people gonna do? Post videos with stupid sounds in the back? Most people will probably go to spotlight, YouTube, and Instagram. Please bring the songs back.",2
7c0b09f8-98ca-4ac2-a3f7-bf2997c6550f,Randomly stopped being able to interact on creators Live streams that I normally interact with. Made reports about it and no help.,2
932593d6-7969-4e6c-a80f-d84f5ac2aaea,"Love the app however ever since the update tik tok no longer shows when the creators I follow are live, even when I go directly to their page.",2
7ec72680-983d-478a-9901-924601116ed1,"I take pictures in portrait mode and when I upload them to tiktok they go landscape,can you please fix this,it's very annoying",2
b69fc0e2-cba9-4141-b7f9-e942bf925730,The for you page continues to show stuff not for me. I do not engage in them and block everything but TT still sends them to me.,2
e147139f-79a7-4009-ae66-6d3a5669551a,"My repost button keeps glitching out and it's really annoying, please try to do something about it, alot of other people have it too",2
5e450115-1d0e-426c-90ce-cab0780ad193,"The app just got updated to have this rediculous spinning animation when ever the app is loading. The whole screen starts to spin around like I'm in a washing machine. It's awful. Please turn these animations off. Also, not a great ui for foldables. All my menu options are on the top left rather than toward the bottom right as would make sense. And I can only pause on the left side of my screen when u folded.",2
c766c3a3-3e34-4e7f-a992-501ef241c8e6,"The reason I give it 2 stars is that(1 It shuts down in my face the moment I open it (2 it's genuinely slow if you could prolly take things away that takes space.(3 If you ARE reading this then pleassse do your best to adjust the app to better as they say down there 👇👇👇👇👇👇👇👇👇 thank you sincerely, Priscilla.",2
26adf9d3-15c6-4966-a667-ca25812d275c,Ever since I updated the app on Friday 22.09.2023 it has been glitching. I can't seem to open the app regardless of how many times I've restarted my devices or reinstall the app. Please fix this bug. Back again on the 13.11.2023 and the bug is still not fixed. I have uninstall and reinstall the app in order to use it. The next time I'm going to just deactivate my account and delete the whole thing 😒,2
68ace7e9-7f42-43a2-b335-080fed945c8d,Don't Really know what is wrong with this App i will open it and it will just show black screen for some minutes. What is all that i keep updating App like What all this?,2
f1a1a91f-9779-4826-9153-bb5f82536e10,It's really hard when you wanna search for a massage again without a search bar in chats. And I don't have the photo and story option.,2
176208ce-c12f-4da7-9740-f60fa8783799,"PLEASE can messages be unsent for both parties!!! It's so embarrassing sending a ""wave"" or a post to someone by accident!!!",2
