reviewId,content,events,events refined,solved by,Verified
83db9a4a-c0c0-4801-a8ff-440b59596bf8,"Keeps logging me out of account saying session expired and everytime I try to log in it won't let me, keeps updating constantly even when I keep it up to date so not sure if the app is glitching, overall not a good app so may have to consider deleting Facebook as this has put me off and happens way too much, keep trying to update the app thinking it was that but its still not working and it says update again even after i already did","['saying session expired and', 'I try to log in it', ""Keeps logging me out of account saying session expired and everytime I try to log in it won't let me keeps updating constantly even when I keep it up to date so not sure if the app is glitching overall not a good app so may have to consider deleting Facebook as this has put me off and happens way too much keep trying to update the app thinking it was that but its still not working and it says update again even after i already did"", 'keeps updating constantly even when I keep it up to date so not sure if the app is glitching overall not a good app', 'even when I keep it up to date so not sure if the app is glitching overall not a good app', 'so may have to consider deleting Facebook as this has put me off and happens way too much', 'as this has put me off and happens way too much', 'happens way too much', 'keep trying to update the app thinking it was that', 'its still not working', 'it says update again even after i already did', 'even after i already did']","[It keeps logging me out, It is saying session expired, I try to log in, It won't let me log in][I keep trying to update the app, It still won't let me log in][I update app, It says update again]",Maman,
77174a84-86bb-4d1c-9301-a9cd680fc39a,Facebook marketplace has a bug or a terrible feature where it will select a random picture as the main one (so the only one buyers see when searching and scrolling) keeps selecting a zoomed up tiny area of damage as the main photo instead of the actual overall photo of an object no wonder no one but scam bots message me now.,"['Facebook marketplace has a bug or a terrible feature where it will select a random picture as the main one so the only one buyers see when searching and scrolling keeps selecting a zoomed up tiny area of damage as the main photo instead of the actual overall photo of an object no wonder no one but scam bots message me now', 'when searching and scrolling', 'keeps selecting a zoomed up tiny area of damage as the main photo instead of the actual overall photo of an object']","[I search and scroll, It will select a random picture as the main one, It keeps selecting a zoomed up tiny area of damage as the main photo instead of the actual overall photo of an object]",Maman,
eeb30392-007d-40c5-8f50-81383f5371d0,I don't know what has happened lately it will not let me log into my Facebook I keep logging in right password and all cuz it starts to log in but then it decides login has expired and kicks me right back out logs me out then it turns around and I log back in and it does the same thing over and over first I thought it might have needed updated so I got it updated and it's still continuing to do it I do not know what is going on with it but it needs fixed,"['all cuz it starts to log in', 'then it decides login has expired and kicks me right back out logs me out then it turns around', 'kicks me right back out', 'logs me out', 'I log back in', 'it does the same thing over and over first', ""I do n't know what has happened lately it will not let me log into my Facebook I keep logging in right password and all cuz it starts to log in but then it decides login has expired and kicks me right back out logs me out then it turns around and I log back in and it does the same thing over and over first I thought it might have needed updated so I got it updated and it 's still continuing to do it"", 'updated', ""it 's still continuing to do it"", 'I do not know what is going on with it', 'but it needs fixed']","[I log in with the right password, The app starts to log in, It decides login has expired, It logs me out, It turns around, I log back in, The app does the same thing over and over, I got it updated, It is still continuing to do the same thing over and over]",Maman,
da10c272-945b-4038-9c2f-cb4ee8c42e63,Can't login at all can't recover my account at all I've tried uninstalling 3 times and tried to get the password reset but never worked just said error oh yeah and made my screen go black one time trying to login and white another time and just froze for a second then kicked me out of the app this app sucks in conclusion and GET actual customer SUPPORT,"[""Can't login at all can't recover my account at all I've tried uninstalling 3 times and tried to get the password reset but never worked just said error"", 'tried to get the password reset', 'never worked', 'and made my screen go black one time trying to login and white another time and just froze for a second then kicked me out of the app this app sucks in conclusion and GET actual customer SUPPORT', 'just froze for a second', 'then kicked me out of the app this app sucks in conclusion and GET actual customer SUPPORT', 'GET actual customer SUPPORT']","[I have tried uninstalling, I tried to get the password reset, It never worked and just said error][I was trying to login, It made my screen go black][I was trying to login, just froze for a second, kicked me out of the app]",Maman,
6ef27210-bee9-4bfc-b2f1-b242ea5d6548,"When I try to share things that I like on my wall, Facebook's algorithm throws it in the irrelevant pile so no-one can see it and then there's the fact I can get my account restricted or giving my opinion on a clip of a MOVIE as to what one CHARACTER in that movie should do to another because it's labeled as ""violent""!!!","['When I try to share things that I like on my wall', ""When I try to share things that I like on my wall Facebook 's algorithm throws it in the irrelevant pile so no one can see it and then there 's the fact I can get my account restricted or giving my opinion on a clip of a MOVIE as to what one CHARACTER in that movie should do to another because it 's labeled as violent"", 'so no one can see it', ""then there 's the fact I can get my account restricted or giving my opinion on a clip of a MOVIE as to what one CHARACTER in that movie should do to another because it 's labeled as violent"", ""giving my opinion on a clip of a MOVIE as to what one CHARACTER in that movie should do to another because it 's labeled as violent"", ""because it 's labeled as violent""]","[I try to share things, it throws it in the irrelevant pile, no one can see it][I give my opinion on a clip of a movie as to what one character in that movie should do to another, It labels the clip as ""violent""]",Khalid,
0c05e514-1831-4f8a-a05f-b2d03ca23ba0,"This app is garbage, it logs y9u.out randomly and you have to spend a ton of time trying to log back in with two factor authentication and it 90% of the time does not work they need to fix that and that would make the app a little better","['This app is garbage it logs y9u.out randomly', 'and you have to spend a ton of time trying to log back in with two factor authentication and it 90 of the time does not work they need to fix that and that would make the app a little better', 'trying to log back in with two factor authentication and it', '90 of the time does not work they need to fix that and that would make the app a little better', 'that would make the app a little better']","[The app logs you out randomly, I try to log back in with two factor authentication, It does not work 90% of the time]",Khalid,
e06d0758-c4fe-40b3-9e62-8377bc8cce94,Suddenly after using FB an hr and a half ago it wouldnt allow me to log in so then it lets me log in and then it says there was an error so it shows me my page but it won't show anything else and then it gets rid of it cuz it goes right back out of it I cannot send any messages either on messenger but it shows me all my messages shows me people been on how long they haven't been on I even updated it now I deleted and I'm reinstalling this is ridiculous that it just worked and suddenly isn't smfh,"['Suddenly after using FB an hr and a half ago it would nt allow me to log in so then it lets me log in and then it says there was an error so it shows me my page', 'so then it lets me log in', 'then it says there was an error so it shows me my page', 'so it shows me my page', ""but it wo n't show anything else"", 'cuz it goes right back out of it', 'it shows me all my messages shows me people been on', ""and then it gets rid of it cuz it goes right back out of it I can not send any messages either on messenger but it shows me all my messages shows me people been on how long they have n't been on I even updated it now I deleted and I 'm reinstalling this is ridiculous that it just worked and suddenly is n't smfh"", 'I deleted', ""I 'm reinstalling this is ridiculous that it just worked and suddenly is n't smfh""]","[ I used the app half an hour ago, It wouldnt allow me to log in now][It lets me log in, It says there was an error, it shows me my page and it won't show anything else, it gets rid of it, it goes right back out of it][It shows me all my messages and it shows me how long people been on and it shows me how long they haven't been on but I cannot send any messages on the app]",Khalid,
3a55fd69-fd14-497c-a361-ae1d80b0d254,"If I could give no stars to leave a rating I would, my facebook completely crashed and I have absolutely no access to it, I cannot log in at all, and when I try to log in it constantly says that session expired.","['If I could give no stars to leave a rating I would', 'I have absolutely no access to it', 'If I could give no stars to leave a rating I would my facebook completely crashed and I have absolutely no access to it I can not log in at all and when I try to log in it constantly says that session expired', 'when I try to log in it', 'when I try to log in it constantly says that session expired']","[The app completely crashed][I have absolutely no access to it][I cannot log in at all][I try to log in, it constantly says that session expired]",Sakib,
3c27c800-5f98-466e-a9e1-d2c6eca22805,They need to fix this app I have used it for so long and never had problems with it until the meta system which now it made me delete my account that I've had for 5 years won't let me log in or make a new account because apparently my session was over and apparently there's a error that won't let me log in or make a new account,"[""They need to fix this app I have used it for so long and never had problems with it until the meta system which now it made me delete my account that I 've had for 5 years wo n't let me log in or make a new account because apparently my session was over and apparently there 's a error that wo n't let me log in or make a new account"", ""I have used it for so long and never had problems with it until the meta system which now it made me delete my account that I 've had for 5 years wo n't let me log in or make a new account because apparently my session was over and apparently there 's a error that wo n't let me log in or make a new account"", ""never had problems with it until the meta system which now it made me delete my account that I 've had for 5 years wo n't let me log in or make a new account because apparently my session was over and apparently there 's a error that wo n't let me log in or make a new account"", ""until the meta system which now it made me delete my account that I 've had for 5 years wo n't let me log in or make a new account because apparently my session was over and apparently there 's a error that wo n't let me log in or make a new account"", ""make a new account because apparently my session was over and apparently there 's a error that wo n't let me log in or make a new account"", ""apparently there 's a error that wo n't let me log in or make a new account"", 'make a new account']","[It deleted my account that I have had for 5 years][I try to log in, It won't let me because my session was over][I try to log in or make a new account, It won't let me with an error]",Sakib,
85880929-43c1-4158-8dda-5fdd924854d0,"My account got hacked from somewhere in Nigeria, they then linked my account to a two-factor authentication on their device, I've tried contact customer support but nothing, and since they persist with a lack of customer support and allowing with sending their users in circles over and over in a never ending loop of inability to get some assistance of any type, I'm going to sadly leave this app and all the hundreds of photos and videos I've posted/shared, it's a shame but good riddance!","['since they persist with a lack of customer support and allowing with sending their users in circles over and over in a never ending loop of inability to get some assistance of any type', 'allowing with sending their users in circles over and over in a never ending loop of inability to get some assistance of any type', 'to get some assistance of any type', ""since they persist with a lack of customer support and allowing with sending their users in circles over and over in a never ending loop of inability to get some assistance of any type I 'm going to sadly leave this app and all the hundreds of photos and videos I 've posted shared""]","[they persist with a lack of customer support, they allow with sending their users in circles over and over in a never ending loop of inability to get some assistance of any type] ",Khalid,
e3148654-d79a-499f-8256-3c847b3ff48b,"The auto refresh on the news feed is making it nearly unusable, click on a link or story, read for 2min then click back and it reloads the whole news feed with the article you just read never to be found again and unable to comment on or read the next article in the news feed you saw before you clicked the first article, this is marketing tactics by Facebook to try and have as much different content jammed in your face as they can to increase marketing revenue income.","['click on a link or story read for 2min then click back', 'read for 2min then click back', 'then click back', 'it reloads the whole news feed with the article you just read never to be found again and unable to comment on or read the next article in the news feed you saw before you clicked the first article', 'read the next article in the news feed you saw before you clicked the first article', 'before you clicked the first article', 'have as much different content jammed in your face as they can', 'to increase marketing revenue income']","[I click on a link or story, I read for 2 minutes, I click back, It reloads the whole news feed and the article never to be found again][I am unable to comment on or read the next article in the news feed i saw before i clicked the first article ]",Khalid,
5a93e144-9dc1-4dc5-ab28-f3db53d92f44,Can't block all reels and ones u can don't work as it's a person not the page just comes back can only mute for 30 days and not block on pages not even apart of the page and reels are incomplete no part 2 to be seen etc when watching and on video tab to get full story's they constantly stop or not play after watching the add without scrolling away and back which is annoying as hell this app while extremely useful in keeping connected to people seems to get worse in all other aspects in time,"[""Ca n't block all reels and ones u can do n't work as it 's a person not the page just comes back can only mute for 30 days and not block on pages not even apart of the page and reels are incomplete no part 2 to be seen etc when watching and on video tab to get full story 's they constantly stop or not play after watching the add without scrolling away and back which is annoying as hell this app while extremely useful in keeping connected to people seems to get worse in all other aspects in time"", 'can only mute for 30 days and not block on pages not even apart of the page and reels', 'not block on pages not even apart of the page and reels', ""when watching and on video tab to get full story 's"", ""to get full story 's"", 'not play after watching the add without scrolling away and back', ""no part 2 to be seen etc when watching and on video tab to get full story 's they constantly stop or not play after watching the add without scrolling away and back which is annoying as hell this app while extremely useful in keeping connected to people seems to get worse in all other aspects in time""]","[I can't block all the reels][I block a reel, It comes back after 30 days][Reels are incomplete with no part 2 to be found][I watch an ad on video tab, the video stop or fail] 




",Khalid,
961bd581-ad08-4d8e-ab63-5f9f74d4032d,"It causes some unexpected log outs and u cant even log in ur acc, also nothing really changes in my opinion still causes some bugs and sudden exit in the app, other one is when u post a myday even your are done is sudenly it just go agin in the posting part like choosing the pic u want to post.",['when u post a myday'],"[The app causes some unexpected log outs][The app does not let me log in to my account][It causes some bugs and sudden exit in the app][I post a myday, the app just go again in the posting part suddenly like choosing the picture I want to post]",Sakib,
fda410a9-01e8-4c98-9130-cc25595ccd99,"If I click a link on Facebook that leads to an external website or some group, and then go back, Facebook completely reloads, returning to the main page and loading new content, instead of as it used to be - going back to the post or comments I was reading, so now i cannot continue reading the thing I am interested in.","['If I click a link on Facebook that leads to an external website or some group and then go back', 'then go back', 'If I click a link on Facebook that leads to an external website or some group and then go back Facebook completely reloads returning to the main page and loading new content instead of as it used to be going back to the post or comments I was reading so now i can not continue reading the thing I am interested in', 'returning to the main page and loading new content instead of as it used to be going back to the post or comments I was reading', 'loading new content', 'as it used to be going back to the post or comments I was reading', 'so now i can not continue reading the thing I am interested in']","[I click a link on Facebook, the app leads to an external website or some group, I go back, the app completely reloads, the app returns to the main page, the app loads new content instead of going back to the post or comments I was reading, I cannot continue reading the thing I am interested in]",Sakib,
df5c782b-ff2f-4098-bc7d-89dc0894434e,"App has been fine until yesterday's update tried to get in today and it keeps telling me session has expired, reinstalled and still locked in that screen and cannot log back in through any of the options.","[""until yesterday 's update tried to get in today"", 'it keeps telling me session has expired reinstalled and still locked in that screen and can not log back in through any of the options', 'reinstalled and still locked in that screen and can not log back in through any of the options', 'still locked in that screen', 'can not log back in through any of the options']","[I updated the app yesterday, I tried to get in today, It keeps telling me session has expired, I reinstalled it, It still locked in that screen, I cannot log back in through any of the options]",Sakib,
09f28b6c-8b94-4c35-a853-034b1bb829f3,"I have a Huawei tablet T5 and 2 days now every time i access fb after about 10 seconds i keep getting the message ""u need to update fb to continue"", i follow the link tha gets me in playstore under fb application where i get 2 options, ""open"" and ""uninstall"", if i hit open gets back to fb and afterca couple o secs i get the same message again, i also did uninstall 3 times so far and nothing changes, any idea why i get this message???","['I have a Huawei tablet T5 and 2 days now every time i access fb after about 10 seconds i keep getting the message u need to update fb to continue i follow the link tha gets me in playstore under fb application where i get 2 options open and uninstall if i hit open gets back to fb and afterca', 'if i hit open', 'afterca']","[I access the app on my Huawei tablet T5, I keep getting the message to update it, I follow the link, It gets me in play store, I get two options: ""open"" and ""uninstall"", I hit open, It gets back to Facebook, I get the same message again][I did uninstall 3 times, Nothing changes]",Sakib,
d5edbdfb-676b-4e64-a207-69614e50f908,"Absolute joke just totally wiped out my existence so tried to get back in, they sent codes by WhatsApp numerous times I NEVER RECEIVED ANY, we will contact your phone and you get in that way OH NO YOU DIDNT so as I can't use fb or msgr I came to app and tried to uninstall but it decided to update so when it's finished we will see if it's worked if not bye bye fb etc","['so tried to get back in', 'Absolute joke just totally wiped out my existence so tried to get back in they sent codes by WhatsApp numerous times I NEVER RECEIVED ANY we will contact your phone and you get in that way', 'you get in that way', 'NO YOU DIDNT', ""so as I ca n't use fb or msgr"", 'msgr', ""so as I ca n't use fb or msgr I came to app and tried to uninstall but it decided to update so when it 's finished we will see if it 's worked if not"", 'tried to uninstall', ""it decided to update so when it 's finished we will see if it 's worked"", ""when it 's finished""]","[I tried to get back in, It sent codes by WhatsApp, I didn't receive any]",Sakib,
5fa73464-83f8-44cb-a2e2-7017fb04594f,It won't log me in even though I enter the saved password it keeps saying sesson expired please log in and when I do it says unable to log in try again later and when I do it repeats the session expired etc over and over again and when you do get a code and enter it the next thing is a blank white page,"['even though I enter the saved password', 'it keeps saying sesson expired please log in', 'when I do', 'when I do it says unable to log in try again later and when I do it repeats the session expired etc over and over again and', 'when I do', 'when I do it repeats the session expired etc over and over again and', 'when you do get a code and enter it', 'enter it']","[I enter the saved password, It won't log me in, It keeps saying sesson expired please log in, I do it, It says unable to log in try again later, I do it, It repeats the session expired over and over again] [I get a code and enter it, It leads to a blank white page]",Sakib,
3de0ed26-d7ad-4a81-9391-c606e6dbc7e1,Literally feel like this app is just something I am forced to keep around so my family can randomly I can't log into the app it just repeatedly keeps telling me to try again even when I set a new password the app restarts and tells me it's messed up I hate that everything leads back to Facebook now,"[""Literally feel like this app is just something I am forced to keep around so my family can randomly I ca n't log into the app it just repeatedly keeps telling me to try again even when I set a new password the app restarts and tells me it 's messed up I hate that everything leads back to Facebook now"", ""so my family can randomly I ca n't log into the app"", ""even when I set a new password the app restarts and tells me it 's messed up"", ""tells me it 's messed up""]","[I can't log into the app, It just repeatedly keeps telling me to try again] [I set a new password, It restarts, It tells me it's messed up]",Sakib,
fb7bbcb6-62fb-4901-b6c3-8faf6f6dc63b,My facebook has been logged out of everysingle time i have closed the app and sometimes while im useing it and it gives me trouble logging back in everytime i have been having this issue since January and its too much personal information for yall to just be messing up and apparently im not the only one,"['My facebook has been logged out of everysingle time i have closed the app and sometimes while i m useing it and it gives me trouble logging back in everytime i have been having this issue since January and its too much personal information for y all to just be messing up and apparently i m not the only one', 'sometimes while i m useing it', 'it gives me trouble logging back in everytime i have been having this issue since January and its too much personal information for y all to just be messing up and apparently i m not the only one', 'for y all to just be messing up and apparently i m not the only one', 'apparently i m not the only one']","[I closed the app, It logs me out everytime, It gives me trouble logging back in] ",Sakib,
