reviewId,content,events,events refined,solved by,Verified
06e35366-e9bb-4948-b460-20d387e50fe2,Why when I try play old videos of any account the video play is very distorted and video pauses only background sound is playing please rectify this issue otherwise the app is good not awesome because when I try to search something it doesn't show ever search engine is poor otherwise the app is nice I hope they will resolve this issue,"['when I try play old videos of any account', 'video pauses', 'I hope they will resolve this issue']","[I try to play old videos of any account, the video play is very distorted,The video pauses and only background sound is playing][When I try to search something, it doesn't show, it's search engine is poor]






",Mainul,
aad6612c-1177-480c-b97c-8d3f455fac59,"Too laggy, keeps crashing when am trying to access my dms, sad to see my favourite app going downhill like this",['when am trying to access my dms'],"[The app is too laggy][I try to access my DMs, It keeps crashing]",Mainul,
9abceb44-99b9-4ea1-a63e-bcd77853ba76,My X app being automatically locks oftenly and then I have to compulsory do verification challenge twice that I'm verily human,"['My X app being automatically locks oftenly', ""and then I have to compulsory do verification challenge twice that I 'm verily human"", ""do verification challenge twice that I 'm verily human""]","[It automatically locks often, I have to compulsory do verify that I'm human]",Mainul,
4b943eee-02ed-47cc-8f35-e968b9780fd9,I really wish this app was half as stable as it was back when it was Twitter....,['I really wish this app was half as stable as it was back when it was Twitter'],[It should be stable like before],Mainul,
3c780d49-c967-4311-af16-22a7dfeff4b5,Why does my app suddenly close when I send a message?,['when I send a message'],"[I try to send a message, it suddenly close]",Mainul,
841fafd6-b532-4da1-9aa2-0602c871fd78,Why does it only send me notifications to like and respond but not to retweet like before you All better fix the problem or I'm unstalling the app,"[""Why does it only send me notifications to like and respond but not to retweet like before you All better fix the problem or I 'm unstalling the app"", ""respond but not to retweet like before you All better fix the problem or I 'm unstalling the app"", ""not to retweet like before you All better fix the problem or I 'm unstalling the app"", ""before you All better fix the problem or I 'm unstalling the app"", ""I 'm unstalling the app""]","[It used to send me notifications to retweet, now it only sends me notifications to like and respond]",Mainul,
72101d2c-f305-4e63-a7c0-20b34fe31987,I can't find my old tweets after one week from the date I post them it's a very sad an app like x can't save at least the people tweets👎🏻,"[""I ca n't find my old tweets after one week from the date I post them it 's a very sad an app like x ca n't save at least the people tweets 👎 🏻""]","[I can't find my old tweets after one week from the date I post them, It can't save peoples tweets]",Mainul,
5cf38d62-f4ae-4013-a7ca-735eb4dcc257,Spaces' not visible on TL after the latest update.,[],[Spaces not visible on timeline],Mainul,
876c9443-ca8f-43e6-a752-5aec03cf9865,"The name X is so stupid and can make conversation so awkward, when putting X in front of other word like videos.","['can make conversation so awkward when putting X in front of other word like videos', 'when putting X in front of other word like videos']","[I struggle to make conversation, I find it awkward when putting X in front of other words like videos]",Ashik,
d52e2da8-eaf6-41b7-b86c-5c3ac1bbad34,"i cant refresh my homepage after i updated this morning, and so many bugs and error","['i ca nt refresh my homepage after i updated this morning and so many bugs and error', 'after i updated this morning']","[I updated this morning, I can't refresh my homepage and encountered so many bugs and errors]",Ashik,
5400f5c5-7ead-4381-bd1f-8adf2b335faf,"the experience is okay but now that it was changed names I hate this stupid app it was called twitter and I will speak for some people but I know down In hearth this app was better before when it was called twitter and not some stupid ""X"" and it was called twitter for generations and I think it should go back","['but now that it was changed names I hate this stupid app it was called twitter and I will speak for some people', 'it was called twitter', 'I will speak for some people', 'but I know down In hearth this app was better before when it was called twitter and not some stupid X and it was called twitter for generations', 'it was called twitter for generations', 'and I think it should go back']","
[I hate this stupid app now, it was changed names, I will speak for some people, I know deep down in my heart this app was better before, it was called twitter for generations, I think it should go back]",Ashik,
564f65a5-ec9c-4260-b2e6-91f2dff7923b,Had to take it off my home screen because it kept saying I had a notification when I didn't.,"[""Had to take it off my home screen because it kept saying I had a notification when I did n't"", ""because it kept saying I had a notification when I did n't"", ""when I did n't""]","[I had to take it off my home screen, it kept saying I had a notification that I didn't]",Ashik,
45d855e4-44af-49d9-a651-ca67698ddde9,"The support section doesn't work so I write here, the list feature is buggy, after I create 2 list and add several members(80), suddenly they stop adding, it's add and immediately remove and says something went wrong","['so I write here', 'after I create 2 list and add several members(80', 'add several members(80', ""The support section does n't work so I write here the list feature is buggy after I create 2 list and add several members(80 suddenly they stop adding it 's add and immediately remove and says something went wrong"", ""it 's add and immediately remove"", 'immediately remove', 'says something went wrong']","[It's  support section doesn't work][I created 2 lists and add several members (80), It adds but immediately removes them, It says something went wrong]",Mainul,
fb0ae847-ee55-4bff-ae75-19a01dbb65b6,"If truly there is freedom of speech on the platform then, I, won't get suspended for Xcing on X..","[""If truly there is freedom of speech on the platform then I wo n't get suspended for Xcing on X""]","[I get suspended for Xcing on X, as it hasn't true freedom of speech]",Ashik,
fd24a274-0c80-4327-9d84-a8f6d9c4d063,"I watch YouTube , Instagram , fb videos on high quality no bufferings, But X always buffers even when video is low quality Very very sloww videos in X Pls fix this soon","['I watch YouTube Instagram fb videos on high quality no bufferings But X always buffers even when video is low quality Very very sloww videos in X', 'Pls fix this soon']","[I watch YouTube, Instagram, and Facebook videos on high quality with no buffering,  X always buffers with low video quality] [X should be fixed soon as it has very slow videos]",Ashik,
853c74e9-77a8-45fe-8032-beb07e2cfbc7,Just make it bit more compatible to 120hz and font are getting changed to default but phone font work when u clear data of X then after sometime its restored to Default X font.,"['Just make it bit more compatible to 120hz and font are getting changed to default but phone font work when u clear data of X then after sometime its restored to Default X font', 'when u clear data of X then after sometime its restored to Default X font']"," [I just make it a bit more compatible to 120Hz] [I changed the phone font of X , it's restored to Default X font after clearing the Data]",Ashik,
f7b67317-7fc8-48fd-a19e-394b663f7e5c,Give me email address for unsuspend my x account I am not able to do that your help center page is also not working where I can appeal your appeal page say logout your account then that is not working I tried 100 times in x app and in browser also give me proper way to contact and unsuspend my account it's showing limit reached my accounts limit reached on dec11 and it showed me it will normal after 3 days and 0 hers and my 3 days completed on yesterday so give me direct email id for support,"[""Give me email address for unsuspend that is not working my x account I am not able to do that your help center page is also not working where I can appeal your appeal page say logout your account then I tried 100 times in x app and in browser also give me proper way to contact and unsuspend my account it 's showing limit reached my accounts limit reached on dec11 and it showed me it will normal after 3 days and 0 hers and my 3 days completed on yesterday so give me direct email i d for support"", 'where I can appeal your appeal page', ""in browser also give me proper way to contact and unsuspend my account it 's showing limit reached my accounts limit reached on dec11 and it showed me it will normal after 3 days and 0 hers and my 3 days completed on yesterday so"", 'unsuspend', 'it showed me it will normal after 3 days and 0 hers and my 3 days completed on yesterday so', 'give me direct email i d for support']","
[""Give me email address for unsuspend, my X account is not working. I am not able to do that. Your help center page is also not working. In browser, also give me proper way to contact and unsuspend my account. It's showing limit reached; my account's limit reached on December 11th and it showed me it will be normal after 3 days. My 3 days completed yesterday. Give me direct email id for support.""]",Ashik,
d3af1dae-2f0f-4dc8-9097-851179e995de,Why does twitter's activity system for each user need to be limited at some point wherein a very close proximity to being banned/locked simultaneously even after resting the account's activity for a while and keeps on doing so.,"[""Why does twitter 's activity system for each user need to be limited at some point wherein a very close proximity to being banned locked simultaneously even after resting the account 's activity for a while and keeps on doing so"", 'keeps on doing so']","[""Twitter's activity system for each user needs to be limited at some point, where in a very close proximity to being banned or locked simultaneously]""]",Ashik,
52e18386-f116-414f-901a-35dedc3688c9,Play bad quality videos even when i enable high quality mobile data and Wifi,"['Play bad quality videos even when i enable high quality mobile data and Wifi', 'even when i enable high quality mobile data and Wifi']","[""Even when I enable high-quality mobile data and Wi-Fi, I play bad quality videos.""]",Ashik,
9e2fc635-d4b8-4f40-a9a4-2473fa5a2758,Can't find spaces when application language is Arabic,"[""Ca n't find spaces when application language is Arabic""]","[I can't find spaces, It has set to Arabic language]",Ashik,
a90880fe-fb2f-429e-acd3-47ba8f5f4ea1,"I enjoy the app overall but ever since I downloaded the latest update I can't send tweets and whenever I ""like"" a post it will disappear.","[""I enjoy the app overall but ever since I downloaded the latest update I ca n't send tweets and whenever I like a post it will disappear"", ""ever since I downloaded the latest update I ca n't send tweets and whenever I like a post it will disappear""]","[I downloaded the latest update of the app, I can't send tweets, everytime I like a post, it will disappear.]",Ashik,
31c18ff1-849b-4f7e-8541-3538becf1d9e,Consuming to much INTERNET DATA being after latest app updates Requesting team X to look into this Thank you,"['Consuming to much INTERNET DATA being after latest app updates Requesting team X to look into this', 'Requesting team X', 'to look into this', 'Consuming to much INTERNET DATA being after latest app updates Requesting team X to look into this Thank you']","[I consume too much INTERNET DATA after updating latest app, I request team X to look into this]",Ashik,
700b7d04-78a5-493e-8799-6e245db885e1,Videos freezes and fails to play and most of the time videos keeps playing even when I go to another page the app is lagging the search doesn't work properly it doesn't show good results and sometimes the search even fails to show results overall the app is miss behaving and it's frustrating 😤,"[""Videos freezes and fails to play and most of the time videos keeps playing even when I go to another page the app is lagging the search does n't work properly it does n't show good results and sometimes the search even fails to show results overall the app is miss behaving and it 's frustrating 😤"", 'fails to play and most of the time', 'even when I go to another page', 'sometimes the search even fails to show results overall the app']","[""I fail to play videos, most of the time videos keep playing even when I go to another page."", ""The app is lagging."", ""The search doesn't work properly, it doesn't show good results as well as sometimes even fails to show results."", ""the app is misbehaving and it's frustrating.""]",Ashik,
981e2651-5726-425b-be7d-f7b5aab47d81,It's at is not a very good I have to verify who I am about every six days it takes about a day and a half to verify who I am and then I have to do it again and I have to change my password ridiculous ridiculous ridiculous if I could give it a negative five I would,"['then I have to do it again', 'I have to change my password ridiculous ridiculous ridiculous if I could give it a negative five', 'if I could give it a negative five']","[""I have to do it again, I have to change my password, which is ridiculous] [I want to give it a negative five.]",Ashik,
c7c0dab3-52f5-4136-b7d5-c212861e9133,Twitter space's not showing after update,"[""Twitter space 's not showing after update""]","[I update the Twitter, Spaces are not showing]",Ashik,
259029f4-f111-43bf-bb67-fed25028a861,Doesn't work when my phone is on charge,"[""Does n't work when my phone is on charge""]","[I charge my phone, it doesn't work]",Ashik,
e6b2d9b7-e467-4f6d-b40f-224e2bfa8438,"App does not load new posts, notifications, or images/audio when my phone is charging.","['App does not load new posts notifications or images audio when my phone is charging', 'when my phone is charging']","[I charge my phone, the app doesn't load new posts notifications and inages audio]",Ashik,
12797501-6dc1-430b-a649-ed94344b14ad,"This was a pretty good app for me to post stuff like when I stream, but something happened, I am not certain this app is the cause of it, but so far I am lead to believe it is, I go ok Twitter, I see a tweet, I press on it to look at the replies, sand then it starts playing some sort of country music and then it wouldn't stop after I closed it, I restarted my phone, I opened it, it started playing again, I deleted it, it kept playing I restarted it, it wasn't playing, I downloaded it, it starts","['for me to post stuff like when I stream', 'when I stream', 'something happened I am not certain this app is the cause of it but so far I am lead to believe it is I go ok Twitter I see a tweet I press on it to look at the replies sand then it starts playing some sort of country music', 'so far I am lead to believe it is I go ok Twitter', ""then it would n't stop after I closed it"", 'after I closed it', ""This was a pretty good app for me to post stuff like when I stream but something happened I am not certain this app is the cause of it but so far I am lead to believe it is I go ok Twitter I see a tweet I press on it to look at the replies sand then it starts playing some sort of country music and then it would n't stop after I closed it I restarted my phone I opened it it started playing again I deleted it it kept playing I restarted it it was n't playing I downloaded it it starts""]","[""I use this app for posting when I stream""] [""I open a tweet to see the replies, it unexpectedly starts playing country music"", ""I close the app, the music wouldn't stop""] [""I delete and reinstall the app, the issue persisted.""]",Ashik,
280288a2-7bb0-44aa-9c70-71b01ecf4b59,"I have been using twitter for years now and I had the greatest experience, but lately I've encountered this issue that everytime I open the app it take a very long time for the pictures and videos to load, I had q great internet connection here in my house the other apps I have no trouble viewing the vids and pica instantly, but here in twitter it really takes a long time to load why is that?","['I have been using twitter for years now', ""lately I 've encountered this issue that everytime I open the app it take a very long time for the pictures and videos to load"", ""and I had the greatest experience but lately I 've encountered this issue that everytime I open the app it take a very long time for the pictures and videos to load I had q great internet connection here in my house the other apps I have no trouble viewing the vids and pica instantly but here in twitter it really takes a long time to load why is that"", 'here in twitter it really takes a long time to load why is that']","
 [""I have been using Twitter for years , I open the app, it takes a very long time for pictures and videos to load, I have a strong internet connection at home. This delay does not occur with other apps.""]",Ashik,
bd51fb95-bb1e-40fb-968f-7141960827d1,"Theres something with the new update that effected spaces and how if im in a space and i go to another app for more than a minute while im listening to the space twitter automatically throws me out the space, its very frustrating especially when im checking google about something that was said in the space, or i wanna check my phone messages while i listen or i just wanna listen to it as a podcast while i do something else, and i cant leave for more then a minute before im just kicked out","['There s something with the new update that effected spaces and how if i m in a space and i go to another app for more than a minute while i m listening to the space twitter automatically throws me out the space its very frustrating especially when i m checking google about something that was said in the space or i wanna check my phone messages while i listen or i just wanna listen to it as a podcast while i do something else and i ca nt leave for more then a minute before i m just kicked out', 'if i m in a space', 'i go to another app for more than a minute while i m listening to the space twitter', 'while i m listening to the space twitter', 'automatically throws me out the space its very frustrating especially when i m checking google about something that was said in the space', 'especially when i m checking google about something that was said in the space', 'i wanna check my phone messages while i listen', 'while i listen', 'or i just wanna listen to it as a podcast while i do something else', 'while i do something else', 'i ca nt leave for more then a minute before i m just kicked out', 'before i m just kicked out']","[""I switch to another app for more than a minute in a space, Twitter automatically ejects me from the Space. I try to check Google for something mentioned in the Space or listen to it like a podcast, it kicked me out.""]",Ashik,
966cd761-df20-4f47-a87a-6f18fdaca72f,"My Twitter is very, very slow to see replies from other people, especially if it takes too long to view photos after the recent update even though my signal is good, And I can't even open my notifications tab, I can't search for other people's account because it takes too long to load, please fix it","['especially if it takes too long to view photos after the recent update even though my signal is good', ""I ca n't even open my notifications tab"", ""My Twitter is very very slow to see replies from other people especially if it takes too long to view photos after the recent update even though my signal is good And I ca n't even open my notifications tab I ca n't search for other people 's account because it takes too long to load please fix it"", 'because it takes too long to load', 'please fix it']","[""Even I have good signals, it takes too long to view photos after the recent update, I can't open my notifications tab""] [""I can't search for other people's accounts, it takes too long to load.""]",Ashik,
ad329e3b-5803-4e45-8d83-18959fc3360c,"The app is getting worse..it keeps glitching and shutting down out of nowhere, it keeps asking to authenticate after making even the slightest changes to my profile, some videos keep glitching and speeding up, I haven't been able to change my username for a while now and I've always disliked the fact that if you're scrolling down a follower/following list, click on an account then go back it'll take you back to the top of the list","['The app is getting worse', 'shutting down out of nowhere', 'it keeps asking to authenticate after making even the slightest changes to my profile some videos keep glitching and speeding up', 'speeding up', ""I 've always disliked the fact that if you 're scrolling down a follower following list click on an account then go back it 'll take you back to the top of the list"", ""if you 're scrolling down a follower following list"", ""that if you 're scrolling down a follower following list click on an account then go back"", 'go back']","[""The app  keeps shutting down out of nowhere, it keeps asking to authenticate after making even the slightest changes to my profile"", ""I've always disliked the fact that if you're scrolling down a follower/following list, clicking on an account, then going back, it'll take you back to the top of the list.""]",Ashik,
bddd0540-13db-4025-b5a6-930597345caf,"VIDEO PLAYER IS NOT GOOD Bring back the old one, that even if you setting the video to never autoplay at least in the old one when you press the video it play itself, but for this new video player you have to press the play button for it to play, dan the button sometimes doesn't respond well, at least bring back the old one or put that feature in the new one","['when you press the video it play itself', 'for this new video player you have to press the play button for it to play', 'for it to play', ""VIDEO PLAYER IS NOT GOOD Bring back the old one that even if you setting the video to never autoplay at least in the old one when you press the video it play itself but for this new video player you have to press the play button for it to play dan the button sometimes does n't respond well at least bring back the old one or put that feature in the new one"", 'put that feature in the new one']","[""I press the video, it plays itself. For this new video player, I have to press the play button for it to play."", ""The video player is not good. Bring back the old one.""]",Ashik,
b8bebbc0-50eb-40dd-a645-65376b92039e,So far my experience has been difficult and I'm still trying to figure out how to use the app I will eventually figure it out though I it is hard to try to figure it out when they want money for everything on the app to talk to get your comments so it actually isn't a app for people that want to just enjoy communication between people because they want money to check your messages or to send a message I think it's messed up that's why I haven't been able to figure it out probably never wil,"[""I 'm still trying to figure out how to use the app I will eventually figure it out though I it is hard to try to figure it out when they want money for everything on the app to talk to get your comments so it actually is n't a app for people that want to just enjoy communication between people because they want money to check your messages or to send a message"", 'when they want money for everything on the app to talk to get your comments', 'to talk to get your comments', 'to get your comments', 'because they want money to check your messages or to send a message', 'to check your messages or to send a message', 'to send a message']","[""I try to figure out how to use the app. It's hard when they want money for everything""] [""It's not an app for people who just want to enjoy communication, they want money to check messages or send one.""]",Ashik,
b2d48685-bb72-4b9c-b510-ec24051a8e16,"Your latest update has twitter all messed up for me - my feed will go straight to the top as everytime i open the app, so now I have to scroll down whenever I need to see tweets I haven't seen before which is really annoying as I preferred it when it would just stay on the part of the feed I left it at and it stays there when I open the app but it no longer does that, it just refreshes to the top.","['i open the app', ""whenever I need to see tweets I have n't seen before which is really annoying as I preferred it"", 'as I preferred it', 'when it would just stay on the part of the feed I left it at', 'it stays there when I open the app', 'when I open the app', 'it no longer does that', ""Your latest update has twitter all messed up for me my feed will go straight to the top as everytime i open the app so now I have to scroll down whenever I need to see tweets I have n't seen before which is really annoying as I preferred it when it would just stay on the part of the feed I left it at and it stays there when I open the app but it no longer does that it just refreshes to the top""]","[""I need to see new tweets, but it's annoying as it used to stay where I left off. The latest update messed up my Twitter, now the feed goes to the top every time I open it.""]",Ashik,
